[57007 ms] UsbSnoop - FilterDispatchAny(a906afd2) : IRP_MJ_INTERNAL_DEVICE_CONTROL
[57007 ms] UsbSnoop - FdoHookDispatchInternalIoctl(a906b1ea) : fdo=8625f508, Irp=86baa278, IRQL=0
[57007 ms]  >>>  URB 7 going down  >>> 
-- URB_FUNCTION_BULK_OR_INTERRUPT_TRANSFER:
  PipeHandle           = 86d6450c [endpoint 0x00000004]
  TransferFlags        = 00000000 (USBD_TRANSFER_DIRECTION_OUT, ~USBD_SHORT_TRANSFER_OK)
  TransferBufferLength = 00000004
  TransferBuffer       = 86d012f8
  TransferBufferMDL    = 00000000
    00000000: 00 78 f0 7e
  UrbLink              = 00000000
[57008 ms] UsbSnoop - MyInternalIOCTLCompletion(a906b126) : fido=868fdb38, Irp=86baa278, Context=86c46db0, IRQL=2
[57008 ms]  <<<  URB 7 coming back  <<< 
-- URB_FUNCTION_BULK_OR_INTERRUPT_TRANSFER:
  PipeHandle           = 86d6450c [endpoint 0x00000004]
  TransferFlags        = 00000000 (USBD_TRANSFER_DIRECTION_OUT, ~USBD_SHORT_TRANSFER_OK)
  TransferBufferLength = 00000004
  TransferBuffer       = 86d012f8
  TransferBufferMDL    = 85fc90f0
  UrbLink              = 00000000
[57010 ms] UsbSnoop - MyInternalIOCTLCompletion(a906b126) : fido=00000000, Irp=85efde48, Context=86ca63e8, IRQL=2
[57010 ms]  <<<  URB 6 coming back  <<< 
-- URB_FUNCTION_BULK_OR_INTERRUPT_TRANSFER:
  PipeHandle           = 86d644ec [endpoint 0x00000084]
  TransferFlags        = 00000003 (USBD_TRANSFER_DIRECTION_IN, USBD_SHORT_TRANSFER_OK)
  TransferBufferLength = 0000003a
  TransferBuffer       = 85e7d000
  TransferBufferMDL    = 86cf8840
    00000000: 00 44 65 63 20 31 38 20 32 30 30 38 30 39 3a 31
    00000010: 37 3a 35 39 4a 75 6e 20 32 34 20 32 30 30 38 52
    00000020: 38 30 30 2e 30 31 20 53 4c 42 52 4c 41 5a 35 2a
    00000030: 06 ac a6 03 02 00 74 67 5e 7e
  UrbLink              = 00000000
[57010 ms] UsbSnoop - FilterDispatchAny(a906afd2) : IRP_MJ_INTERNAL_DEVICE_CONTROL
[57010 ms] UsbSnoop - FdoHookDispatchInternalIoctl(a906b1ea) : fdo=8625f508, Irp=85efde48, IRQL=2
[57010 ms]  >>>  URB 8 going down  >>> 
-- URB_FUNCTION_BULK_OR_INTERRUPT_TRANSFER:
  PipeHandle           = 86d644ec [endpoint 0x00000084]
  TransferFlags        = 00000003 (USBD_TRANSFER_DIRECTION_IN, USBD_SHORT_TRANSFER_OK)
  TransferBufferLength = 00001000
  TransferBuffer       = 85e7d03a
  TransferBufferMDL    = 00000000
  UrbLink              = 00000000
[57043 ms] UsbSnoop - FilterDispatchAny(a906afd2) : IRP_MJ_INTERNAL_DEVICE_CONTROL
[57043 ms] UsbSnoop - FdoHookDispatchInternalIoctl(a906b1ea) : fdo=8625f508, Irp=86baa278, IRQL=0
[57043 ms]  >>>  URB 9 going down  >>> 
-- URB_FUNCTION_BULK_OR_INTERRUPT_TRANSFER:
  PipeHandle           = 86d6450c [endpoint 0x00000004]
  TransferFlags        = 00000000 (USBD_TRANSFER_DIRECTION_OUT, ~USBD_SHORT_TRANSFER_OK)
  TransferBufferLength = 00000006
  TransferBuffer       = 86d012f8
  TransferBufferMDL    = 00000000
    00000000: 33 7d 5f fd 18 7e
  UrbLink              = 00000000
[57044 ms] UsbSnoop - MyInternalIOCTLCompletion(a906b126) : fido=868fdb38, Irp=86baa278, Context=86c46db0, IRQL=2
[57044 ms]  <<<  URB 9 coming back  <<< 
-- URB_FUNCTION_BULK_OR_INTERRUPT_TRANSFER:
  PipeHandle           = 86d6450c [endpoint 0x00000004]
  TransferFlags        = 00000000 (USBD_TRANSFER_DIRECTION_OUT, ~USBD_SHORT_TRANSFER_OK)
  TransferBufferLength = 00000006
  TransferBuffer       = 86d012f8
  TransferBufferMDL    = 86b55150
  UrbLink              = 00000000
[57045 ms] UsbSnoop - MyInternalIOCTLCompletion(a906b126) : fido=00000000, Irp=85efde48, Context=86ca63e8, IRQL=2
[57045 ms]  <<<  URB 8 coming back  <<< 
-- URB_FUNCTION_BULK_OR_INTERRUPT_TRANSFER:
  PipeHandle           = 86d644ec [endpoint 0x00000084]
  TransferFlags        = 00000003 (USBD_TRANSFER_DIRECTION_IN, USBD_SHORT_TRANSFER_OK)
  TransferBufferLength = 00000006
  TransferBuffer       = 85e7d03a
  TransferBufferMDL    = 86cf8840
    00000000: 13 33 7f 87 bb 7e
  UrbLink              = 00000000
[57045 ms] UsbSnoop - FilterDispatchAny(a906afd2) : IRP_MJ_INTERNAL_DEVICE_CONTROL
[57045 ms] UsbSnoop - FdoHookDispatchInternalIoctl(a906b1ea) : fdo=8625f508, Irp=85efde48, IRQL=2
[57045 ms]  >>>  URB 10 going down  >>> 
-- URB_FUNCTION_BULK_OR_INTERRUPT_TRANSFER:
  PipeHandle           = 86d644ec [endpoint 0x00000084]
  TransferFlags        = 00000003 (USBD_TRANSFER_DIRECTION_IN, USBD_SHORT_TRANSFER_OK)
  TransferBufferLength = 00001000
  TransferBuffer       = 85e7d040
  TransferBufferMDL    = 00000000
  UrbLink              = 00000000
[57048 ms] UsbSnoop - FilterDispatchAny(a906afd2) : IRP_MJ_INTERNAL_DEVICE_CONTROL
[57048 ms] UsbSnoop - FdoHookDispatchInternalIoctl(a906b1ea) : fdo=8625f508, Irp=85f47630, IRQL=0
[57048 ms]  >>>  URB 11 going down  >>> 
-- URB_FUNCTION_BULK_OR_INTERRUPT_TRANSFER:
  PipeHandle           = 86d6450c [endpoint 0x00000004]
  TransferFlags        = 00000000 (USBD_TRANSFER_DIRECTION_OUT, ~USBD_SHORT_TRANSFER_OK)
  TransferBufferLength = 00000088
  TransferBuffer       = 86c1b220
  TransferBufferMDL    = 00000000
    00000000: 26 b1 00 01 00 00 00 00 00 00 00 00 00 00 00 00
    00000010: 00 00 00 00 00 00 00 00 00 00 00 00 00 00 00 00
    00000020: 00 00 00 00 00 00 00 00 00 00 00 00 00 00 00 00
    00000030: 00 00 00 00 00 00 00 00 00 00 00 00 00 00 00 00
    00000040: 00 00 00 00 00 00 00 00 00 00 00 00 00 00 00 00
    00000050: 00 00 00 00 00 00 00 00 00 00 00 00 00 00 00 00
    00000060: 00 00 00 00 00 00 00 00 00 00 00 00 00 00 00 00
    00000070: 00 00 00 00 00 00 00 00 00 00 00 00 00 00 00 00
    00000080: 00 00 00 00 00 14 0a 7e
  UrbLink              = 00000000
[57049 ms] UsbSnoop - MyInternalIOCTLCompletion(a906b126) : fido=868fdb38, Irp=85f47630, Context=86c46db0, IRQL=2
[57049 ms]  <<<  URB 11 coming back  <<< 
-- URB_FUNCTION_BULK_OR_INTERRUPT_TRANSFER:
  PipeHandle           = 86d6450c [endpoint 0x00000004]
  TransferFlags        = 00000000 (USBD_TRANSFER_DIRECTION_OUT, ~USBD_SHORT_TRANSFER_OK)
  TransferBufferLength = 00000088
  TransferBuffer       = 86c1b220
  TransferBufferMDL    = 85fc90f0
  UrbLink              = 00000000
[57051 ms] UsbSnoop - MyInternalIOCTLCompletion(a906b126) : fido=00000000, Irp=85efde48, Context=86ca63e8, IRQL=2
[57051 ms]  <<<  URB 10 coming back  <<< 
-- URB_FUNCTION_BULK_OR_INTERRUPT_TRANSFER:
  PipeHandle           = 86d644ec [endpoint 0x00000084]
  TransferFlags        = 00000003 (USBD_TRANSFER_DIRECTION_IN, USBD_SHORT_TRANSFER_OK)
  TransferBufferLength = 00000088
  TransferBuffer       = 85e7d040
  TransferBufferMDL    = 86cf8840
    00000000: 26 b1 00 01 10 00 00 00 00 00 00 00 00 00 00 00
    00000010: 00 00 00 00 00 00 00 00 00 00 00 00 00 00 00 00
    00000020: 00 00 00 00 00 00 00 00 00 00 00 00 00 00 00 00
    00000030: 00 00 00 00 00 00 00 00 00 00 00 00 00 00 00 00
    00000040: 00 00 00 00 00 00 00 00 00 00 00 00 00 00 00 00
    00000050: 00 00 00 00 00 00 00 00 00 00 00 00 00 00 00 00
    00000060: 00 00 00 00 00 00 00 00 00 00 00 00 00 00 00 00
    00000070: 00 00 00 00 00 00 00 00 00 00 00 00 00 00 00 00
    00000080: 00 00 00 00 00 f1 95 7e
  UrbLink              = 00000000
[57051 ms] UsbSnoop - FilterDispatchAny(a906afd2) : IRP_MJ_INTERNAL_DEVICE_CONTROL
[57051 ms] UsbSnoop - FdoHookDispatchInternalIoctl(a906b1ea) : fdo=8625f508, Irp=85efde48, IRQL=2
[57051 ms]  >>>  URB 12 going down  >>> 
-- URB_FUNCTION_BULK_OR_INTERRUPT_TRANSFER:
  PipeHandle           = 86d644ec [endpoint 0x00000084]
  TransferFlags        = 00000003 (USBD_TRANSFER_DIRECTION_IN, USBD_SHORT_TRANSFER_OK)
  TransferBufferLength = 00001000
  TransferBuffer       = 85e7d0c8
  TransferBufferMDL    = 00000000
  UrbLink              = 00000000
[57616 ms] UsbSnoop - FilterDispatchAny(a906afd2) : IRP_MJ_INTERNAL_DEVICE_CONTROL
[57616 ms] UsbSnoop - FdoHookDispatchInternalIoctl(a906b1ea) : fdo=8625f508, Irp=85f47630, IRQL=0
[57616 ms]  >>>  URB 13 going down  >>> 
-- URB_FUNCTION_BULK_OR_INTERRUPT_TRANSFER:
  PipeHandle           = 86d6450c [endpoint 0x00000004]
  TransferFlags        = 00000000 (USBD_TRANSFER_DIRECTION_OUT, ~USBD_SHORT_TRANSFER_OK)
  TransferBufferLength = 00000088
  TransferBuffer       = 86c1b220
  TransferBufferMDL    = 00000000
    00000000: 26 04 00 00 00 00 00 00 00 00 00 00 00 00 00 00
    00000010: 00 00 00 00 00 00 00 00 00 00 00 00 00 00 00 00
    00000020: 00 00 00 00 00 00 00 00 00 00 00 00 00 00 00 00
    00000030: 00 00 00 00 00 00 00 00 00 00 00 00 00 00 00 00
    00000040: 00 00 00 00 00 00 00 00 00 00 00 00 00 00 00 00
    00000050: 00 00 00 00 00 00 00 00 00 00 00 00 00 00 00 00
    00000060: 00 00 00 00 00 00 00 00 00 00 00 00 00 00 00 00
    00000070: 00 00 00 00 00 00 00 00 00 00 00 00 00 00 00 00
    00000080: 00 00 00 00 00 0b ba 7e
  UrbLink              = 00000000
[57618 ms] UsbSnoop - MyInternalIOCTLCompletion(a906b126) : fido=868fdb38, Irp=85f47630, Context=86c46db0, IRQL=2
[57618 ms]  <<<  URB 13 coming back  <<< 
-- URB_FUNCTION_BULK_OR_INTERRUPT_TRANSFER:
  PipeHandle           = 86d6450c [endpoint 0x00000004]
  TransferFlags        = 00000000 (USBD_TRANSFER_DIRECTION_OUT, ~USBD_SHORT_TRANSFER_OK)
  TransferBufferLength = 00000088
  TransferBuffer       = 86c1b220
  TransferBufferMDL    = 86b413a8
  UrbLink              = 00000000
[57619 ms] UsbSnoop - MyInternalIOCTLCompletion(a906b126) : fido=00000000, Irp=85efde48, Context=86ca63e8, IRQL=2
[57619 ms]  <<<  URB 12 coming back  <<< 
-- URB_FUNCTION_BULK_OR_INTERRUPT_TRANSFER:
  PipeHandle           = 86d644ec [endpoint 0x00000084]
  TransferFlags        = 00000003 (USBD_TRANSFER_DIRECTION_IN, USBD_SHORT_TRANSFER_OK)
  TransferBufferLength = 00000088
  TransferBuffer       = 85e7d0c8
  TransferBufferMDL    = 86cf8840
    00000000: 26 04 00 3a 00 00 00 00 00 00 00 00 00 00 00 00
    00000010: 00 00 00 00 00 00 00 00 00 00 00 00 00 00 00 00
    00000020: 00 00 00 00 00 00 00 00 00 00 00 00 00 00 00 00
    00000030: 00 00 00 00 00 00 00 00 00 00 00 00 00 00 00 00
    00000040: 00 00 00 00 00 00 00 00 00 00 00 00 00 00 00 00
    00000050: 00 00 00 00 00 00 00 00 00 00 00 00 00 00 00 00
    00000060: 00 00 00 00 00 00 00 00 00 00 00 00 00 00 00 00
    00000070: 00 00 00 00 00 00 00 00 00 00 00 00 00 00 00 00
    00000080: 00 00 00 00 00 4f a8 7e
  UrbLink              = 00000000
[57619 ms] UsbSnoop - FilterDispatchAny(a906afd2) : IRP_MJ_INTERNAL_DEVICE_CONTROL
[57619 ms] UsbSnoop - FdoHookDispatchInternalIoctl(a906b1ea) : fdo=8625f508, Irp=85efde48, IRQL=2
[57619 ms]  >>>  URB 14 going down  >>> 
-- URB_FUNCTION_BULK_OR_INTERRUPT_TRANSFER:
  PipeHandle           = 86d644ec [endpoint 0x00000084]
  TransferFlags        = 00000003 (USBD_TRANSFER_DIRECTION_IN, USBD_SHORT_TRANSFER_OK)
  TransferBufferLength = 00001000
  TransferBuffer       = 85e7d150
  TransferBufferMDL    = 00000000
  UrbLink              = 00000000
[57621 ms] UsbSnoop - FilterDispatchAny(a906afd2) : IRP_MJ_INTERNAL_DEVICE_CONTROL
[57621 ms] UsbSnoop - FdoHookDispatchInternalIoctl(a906b1ea) : fdo=8625f508, Irp=85ecee28, IRQL=0
[57621 ms]  >>>  URB 15 going down  >>> 
-- URB_FUNCTION_BULK_OR_INTERRUPT_TRANSFER:
  PipeHandle           = 86d6450c [endpoint 0x00000004]
  TransferFlags        = 00000000 (USBD_TRANSFER_DIRECTION_OUT, ~USBD_SHORT_TRANSFER_OK)
  TransferBufferLength = 00000088
  TransferBuffer       = 86d284f0
  TransferBufferMDL    = 00000000
    00000000: 26 05 00 00 00 00 00 00 00 00 00 00 00 00 00 00
    00000010: 00 00 00 00 00 00 00 00 00 00 00 00 00 00 00 00
    00000020: 00 00 00 00 00 00 00 00 00 00 00 00 00 00 00 00
    00000030: 00 00 00 00 00 00 00 00 00 00 00 00 00 00 00 00
    00000040: 00 00 00 00 00 00 00 00 00 00 00 00 00 00 00 00
    00000050: 00 00 00 00 00 00 00 00 00 00 00 00 00 00 00 00
    00000060: 00 00 00 00 00 00 00 00 00 00 00 00 00 00 00 00
    00000070: 00 00 00 00 00 00 00 00 00 00 00 00 00 00 00 00
    00000080: 00 00 00 00 00 2a 24 7e
  UrbLink              = 00000000
[57622 ms] UsbSnoop - MyInternalIOCTLCompletion(a906b126) : fido=868fdb38, Irp=85ecee28, Context=86c46db0, IRQL=2
[57622 ms]  <<<  URB 15 coming back  <<< 
-- URB_FUNCTION_BULK_OR_INTERRUPT_TRANSFER:
  PipeHandle           = 86d6450c [endpoint 0x00000004]
  TransferFlags        = 00000000 (USBD_TRANSFER_DIRECTION_OUT, ~USBD_SHORT_TRANSFER_OK)
  TransferBufferLength = 00000088
  TransferBuffer       = 86d284f0
  TransferBufferMDL    = 85fc90f0
  UrbLink              = 00000000
[57623 ms] UsbSnoop - MyInternalIOCTLCompletion(a906b126) : fido=00000000, Irp=85efde48, Context=86ca63e8, IRQL=2
[57623 ms]  <<<  URB 14 coming back  <<< 
-- URB_FUNCTION_BULK_OR_INTERRUPT_TRANSFER:
  PipeHandle           = 86d644ec [endpoint 0x00000084]
  TransferFlags        = 00000003 (USBD_TRANSFER_DIRECTION_IN, USBD_SHORT_TRANSFER_OK)
  TransferBufferLength = 00000088
  TransferBuffer       = 85e7d150
  TransferBufferMDL    = 86cf8840
    00000000: 26 05 00 02 00 00 00 00 00 00 00 00 00 00 00 00
    00000010: 00 00 00 00 00 00 00 00 00 00 00 00 00 00 00 00
    00000020: 00 00 00 00 00 00 00 00 00 00 00 00 00 00 00 00
    00000030: 00 00 00 00 00 00 00 00 00 00 00 00 00 00 00 00
    00000040: 00 00 00 00 00 00 00 00 00 00 00 00 00 00 00 00
    00000050: 00 00 00 00 00 00 00 00 00 00 00 00 00 00 00 00
    00000060: 00 00 00 00 00 00 00 00 00 00 00 00 00 00 00 00
    00000070: 00 00 00 00 00 00 00 00 00 00 00 00 00 00 00 00
    00000080: 00 00 00 00 00 25 b6 7e
  UrbLink              = 00000000
[57623 ms] UsbSnoop - FilterDispatchAny(a906afd2) : IRP_MJ_INTERNAL_DEVICE_CONTROL
[57623 ms] UsbSnoop - FdoHookDispatchInternalIoctl(a906b1ea) : fdo=8625f508, Irp=85efde48, IRQL=2
[57623 ms]  >>>  URB 16 going down  >>> 
-- URB_FUNCTION_BULK_OR_INTERRUPT_TRANSFER:
  PipeHandle           = 86d644ec [endpoint 0x00000084]
  TransferFlags        = 00000003 (USBD_TRANSFER_DIRECTION_IN, USBD_SHORT_TRANSFER_OK)
  TransferBufferLength = 00001000
  TransferBuffer       = 85e7d1d8
  TransferBufferMDL    = 00000000
  UrbLink              = 00000000
[57625 ms] UsbSnoop - FilterDispatchAny(a906afd2) : IRP_MJ_INTERNAL_DEVICE_CONTROL
[57625 ms] UsbSnoop - FdoHookDispatchInternalIoctl(a906b1ea) : fdo=8625f508, Irp=85ecee28, IRQL=0
[57625 ms]  >>>  URB 17 going down  >>> 
-- URB_FUNCTION_BULK_OR_INTERRUPT_TRANSFER:
  PipeHandle           = 86d6450c [endpoint 0x00000004]
  TransferFlags        = 00000000 (USBD_TRANSFER_DIRECTION_OUT, ~USBD_SHORT_TRANSFER_OK)
  TransferBufferLength = 00000088
  TransferBuffer       = 86d284f0
  TransferBufferMDL    = 00000000
    00000000: 26 28 00 00 00 00 00 00 00 00 00 00 00 00 00 00
    00000010: 00 00 00 00 00 00 00 00 00 00 00 00 00 00 00 00
    00000020: 00 00 00 00 00 00 00 00 00 00 00 00 00 00 00 00
    00000030: 00 00 00 00 00 00 00 00 00 00 00 00 00 00 00 00
    00000040: 00 00 00 00 00 00 00 00 00 00 00 00 00 00 00 00
    00000050: 00 00 00 00 00 00 00 00 00 00 00 00 00 00 00 00
    00000060: 00 00 00 00 00 00 00 00 00 00 00 00 00 00 00 00
    00000070: 00 00 00 00 00 00 00 00 00 00 00 00 00 00 00 00
    00000080: 00 00 00 00 00 e2 5e 7e
  UrbLink              = 00000000
[57626 ms] UsbSnoop - MyInternalIOCTLCompletion(a906b126) : fido=868fdb38, Irp=85ecee28, Context=86c46db0, IRQL=2
[57626 ms]  <<<  URB 17 coming back  <<< 
-- URB_FUNCTION_BULK_OR_INTERRUPT_TRANSFER:
  PipeHandle           = 86d6450c [endpoint 0x00000004]
  TransferFlags        = 00000000 (USBD_TRANSFER_DIRECTION_OUT, ~USBD_SHORT_TRANSFER_OK)
  TransferBufferLength = 00000088
  TransferBuffer       = 86d284f0
  TransferBufferMDL    = 86bdc8e0
  UrbLink              = 00000000
[57627 ms] UsbSnoop - MyInternalIOCTLCompletion(a906b126) : fido=00000000, Irp=85efde48, Context=86ca63e8, IRQL=2
[57627 ms]  <<<  URB 16 coming back  <<< 
-- URB_FUNCTION_BULK_OR_INTERRUPT_TRANSFER:
  PipeHandle           = 86d644ec [endpoint 0x00000084]
  TransferFlags        = 00000003 (USBD_TRANSFER_DIRECTION_IN, USBD_SHORT_TRANSFER_OK)
  TransferBufferLength = 00000088
  TransferBuffer       = 85e7d1d8
  TransferBufferMDL    = 86cf8840
    00000000: 26 28 00 00 00 00 00 00 00 00 00 00 00 00 00 00
    00000010: 00 00 00 00 00 00 00 00 00 00 00 00 00 00 00 00
    00000020: 00 00 00 00 00 00 00 00 00 00 00 00 00 00 00 00
    00000030: 00 00 00 00 00 00 00 00 00 00 00 00 00 00 00 00
    00000040: 00 00 00 00 00 00 00 00 00 00 00 00 00 00 00 00
    00000050: 00 00 00 00 00 00 00 00 00 00 00 00 00 00 00 00
    00000060: 00 00 00 00 00 00 00 00 00 00 00 00 00 00 00 00
    00000070: 00 00 00 00 00 00 00 00 00 00 00 00 00 00 00 00
    00000080: 00 00 00 00 00 e2 5e 7e
  UrbLink              = 00000000
[57627 ms] UsbSnoop - FilterDispatchAny(a906afd2) : IRP_MJ_INTERNAL_DEVICE_CONTROL
[57627 ms] UsbSnoop - FdoHookDispatchInternalIoctl(a906b1ea) : fdo=8625f508, Irp=85efde48, IRQL=2
[57627 ms]  >>>  URB 18 going down  >>> 
-- URB_FUNCTION_BULK_OR_INTERRUPT_TRANSFER:
  PipeHandle           = 86d644ec [endpoint 0x00000084]
  TransferFlags        = 00000003 (USBD_TRANSFER_DIRECTION_IN, USBD_SHORT_TRANSFER_OK)
  TransferBufferLength = 00001000
  TransferBuffer       = 85e7d260
  TransferBufferMDL    = 00000000
  UrbLink              = 00000000
[57629 ms] UsbSnoop - FilterDispatchAny(a906afd2) : IRP_MJ_INTERNAL_DEVICE_CONTROL
[57629 ms] UsbSnoop - FdoHookDispatchInternalIoctl(a906b1ea) : fdo=8625f508, Irp=85ecee28, IRQL=0
[57629 ms]  >>>  URB 19 going down  >>> 
-- URB_FUNCTION_BULK_OR_INTERRUPT_TRANSFER:
  PipeHandle           = 86d6450c [endpoint 0x00000004]
  TransferFlags        = 00000000 (USBD_TRANSFER_DIRECTION_OUT, ~USBD_SHORT_TRANSFER_OK)
  TransferBufferLength = 00000088
  TransferBuffer       = 86d284f0
  TransferBufferMDL    = 00000000
    00000000: 26 b0 00 01 00 00 00 00 00 00 00 00 00 00 00 00
    00000010: 00 00 00 00 00 00 00 00 00 00 00 00 00 00 00 00
    00000020: 00 00 00 00 00 00 00 00 00 00 00 00 00 00 00 00
    00000030: 00 00 00 00 00 00 00 00 00 00 00 00 00 00 00 00
    00000040: 00 00 00 00 00 00 00 00 00 00 00 00 00 00 00 00
    00000050: 00 00 00 00 00 00 00 00 00 00 00 00 00 00 00 00
    00000060: 00 00 00 00 00 00 00 00 00 00 00 00 00 00 00 00
    00000070: 00 00 00 00 00 00 00 00 00 00 00 00 00 00 00 00
    00000080: 00 00 00 00 00 35 94 7e
  UrbLink              = 00000000
[57630 ms] UsbSnoop - MyInternalIOCTLCompletion(a906b126) : fido=868fdb38, Irp=85ecee28, Context=86c46db0, IRQL=2
[57630 ms]  <<<  URB 19 coming back  <<< 
-- URB_FUNCTION_BULK_OR_INTERRUPT_TRANSFER:
  PipeHandle           = 86d6450c [endpoint 0x00000004]
  TransferFlags        = 00000000 (USBD_TRANSFER_DIRECTION_OUT, ~USBD_SHORT_TRANSFER_OK)
  TransferBufferLength = 00000088
  TransferBuffer       = 86d284f0
  TransferBufferMDL    = 86b17ac0
  UrbLink              = 00000000
[57632 ms] UsbSnoop - MyInternalIOCTLCompletion(a906b126) : fido=00000000, Irp=85efde48, Context=86ca63e8, IRQL=2
[57632 ms]  <<<  URB 18 coming back  <<< 
-- URB_FUNCTION_BULK_OR_INTERRUPT_TRANSFER:
  PipeHandle           = 86d644ec [endpoint 0x00000084]
  TransferFlags        = 00000003 (USBD_TRANSFER_DIRECTION_IN, USBD_SHORT_TRANSFER_OK)
  TransferBufferLength = 00000088
  TransferBuffer       = 85e7d260
  TransferBufferMDL    = 86cf8840
    00000000: 26 b0 00 01 c8 00 00 00 00 00 00 00 00 00 00 00
    00000010: 00 00 00 00 00 00 00 00 00 00 00 00 00 00 00 00
    00000020: 00 00 00 00 00 00 00 00 00 00 00 00 00 00 00 00
    00000030: 00 00 00 00 00 00 00 00 00 00 00 00 00 00 00 00
    00000040: 00 00 00 00 00 00 00 00 00 00 00 00 00 00 00 00
    00000050: 00 00 00 00 00 00 00 00 00 00 00 00 00 00 00 00
    00000060: 00 00 00 00 00 00 00 00 00 00 00 00 00 00 00 00
    00000070: 00 00 00 00 00 00 00 00 00 00 00 00 00 00 00 00
    00000080: 00 00 00 00 00 15 ef 7e
  UrbLink              = 00000000
[57632 ms] UsbSnoop - FilterDispatchAny(a906afd2) : IRP_MJ_INTERNAL_DEVICE_CONTROL
[57632 ms] UsbSnoop - FdoHookDispatchInternalIoctl(a906b1ea) : fdo=8625f508, Irp=85efde48, IRQL=2
[57632 ms]  >>>  URB 20 going down  >>> 
-- URB_FUNCTION_BULK_OR_INTERRUPT_TRANSFER:
  PipeHandle           = 86d644ec [endpoint 0x00000084]
  TransferFlags        = 00000003 (USBD_TRANSFER_DIRECTION_IN, USBD_SHORT_TRANSFER_OK)
  TransferBufferLength = 00001000
  TransferBuffer       = 85e7d2e8
  TransferBufferMDL    = 00000000
  UrbLink              = 00000000
[57634 ms] UsbSnoop - FilterDispatchAny(a906afd2) : IRP_MJ_INTERNAL_DEVICE_CONTROL
[57634 ms] UsbSnoop - FdoHookDispatchInternalIoctl(a906b1ea) : fdo=8625f508, Irp=85ecee28, IRQL=0
[57634 ms]  >>>  URB 21 going down  >>> 
-- URB_FUNCTION_BULK_OR_INTERRUPT_TRANSFER:
  PipeHandle           = 86d6450c [endpoint 0x00000004]
  TransferFlags        = 00000000 (USBD_TRANSFER_DIRECTION_OUT, ~USBD_SHORT_TRANSFER_OK)
  TransferBufferLength = 00000088
  TransferBuffer       = 86d284f0
  TransferBufferMDL    = 00000000
    00000000: 26 b1 00 01 00 00 00 00 00 00 00 00 00 00 00 00
    00000010: 00 00 00 00 00 00 00 00 00 00 00 00 00 00 00 00
    00000020: 00 00 00 00 00 00 00 00 00 00 00 00 00 00 00 00
    00000030: 00 00 00 00 00 00 00 00 00 00 00 00 00 00 00 00
    00000040: 00 00 00 00 00 00 00 00 00 00 00 00 00 00 00 00
    00000050: 00 00 00 00 00 00 00 00 00 00 00 00 00 00 00 00
    00000060: 00 00 00 00 00 00 00 00 00 00 00 00 00 00 00 00
    00000070: 00 00 00 00 00 00 00 00 00 00 00 00 00 00 00 00
    00000080: 00 00 00 00 00 14 0a 7e
  UrbLink              = 00000000
[57635 ms] UsbSnoop - MyInternalIOCTLCompletion(a906b126) : fido=868fdb38, Irp=85ecee28, Context=86c46db0, IRQL=2
[57635 ms]  <<<  URB 21 coming back  <<< 
-- URB_FUNCTION_BULK_OR_INTERRUPT_TRANSFER:
  PipeHandle           = 86d6450c [endpoint 0x00000004]
  TransferFlags        = 00000000 (USBD_TRANSFER_DIRECTION_OUT, ~USBD_SHORT_TRANSFER_OK)
  TransferBufferLength = 00000088
  TransferBuffer       = 86d284f0
  TransferBufferMDL    = 86498b80
  UrbLink              = 00000000
[57637 ms] UsbSnoop - MyInternalIOCTLCompletion(a906b126) : fido=00000000, Irp=85efde48, Context=86ca63e8, IRQL=2
[57637 ms]  <<<  URB 20 coming back  <<< 
-- URB_FUNCTION_BULK_OR_INTERRUPT_TRANSFER:
  PipeHandle           = 86d644ec [endpoint 0x00000084]
  TransferFlags        = 00000003 (USBD_TRANSFER_DIRECTION_IN, USBD_SHORT_TRANSFER_OK)
  TransferBufferLength = 00000088
  TransferBuffer       = 85e7d2e8
  TransferBufferMDL    = 86cf8840
    00000000: 26 b1 00 01 10 00 00 00 00 00 00 00 00 00 00 00
    00000010: 00 00 00 00 00 00 00 00 00 00 00 00 00 00 00 00
    00000020: 00 00 00 00 00 00 00 00 00 00 00 00 00 00 00 00
    00000030: 00 00 00 00 00 00 00 00 00 00 00 00 00 00 00 00
    00000040: 00 00 00 00 00 00 00 00 00 00 00 00 00 00 00 00
    00000050: 00 00 00 00 00 00 00 00 00 00 00 00 00 00 00 00
    00000060: 00 00 00 00 00 00 00 00 00 00 00 00 00 00 00 00
    00000070: 00 00 00 00 00 00 00 00 00 00 00 00 00 00 00 00
    00000080: 00 00 00 00 00 f1 95 7e
  UrbLink              = 00000000
[57637 ms] UsbSnoop - FilterDispatchAny(a906afd2) : IRP_MJ_INTERNAL_DEVICE_CONTROL
[57637 ms] UsbSnoop - FdoHookDispatchInternalIoctl(a906b1ea) : fdo=8625f508, Irp=85efde48, IRQL=2
[57637 ms]  >>>  URB 22 going down  >>> 
-- URB_FUNCTION_BULK_OR_INTERRUPT_TRANSFER:
  PipeHandle           = 86d644ec [endpoint 0x00000084]
  TransferFlags        = 00000003 (USBD_TRANSFER_DIRECTION_IN, USBD_SHORT_TRANSFER_OK)
  TransferBufferLength = 00001000
  TransferBuffer       = 85e7d370
  TransferBufferMDL    = 00000000
  UrbLink              = 00000000
[57639 ms] UsbSnoop - FilterDispatchAny(a906afd2) : IRP_MJ_INTERNAL_DEVICE_CONTROL
[57639 ms] UsbSnoop - FdoHookDispatchInternalIoctl(a906b1ea) : fdo=8625f508, Irp=85ecee28, IRQL=0
[57639 ms]  >>>  URB 23 going down  >>> 
-- URB_FUNCTION_BULK_OR_INTERRUPT_TRANSFER:
  PipeHandle           = 86d6450c [endpoint 0x00000004]
  TransferFlags        = 00000000 (USBD_TRANSFER_DIRECTION_OUT, ~USBD_SHORT_TRANSFER_OK)
  TransferBufferLength = 00000088
  TransferBuffer       = 86d284f0
  TransferBufferMDL    = 00000000
    00000000: 26 21 00 01 00 00 00 00 00 00 00 00 00 00 00 00
    00000010: 00 00 00 00 00 00 00 00 00 00 00 00 00 00 00 00
    00000020: 00 00 00 00 00 00 00 00 00 00 00 00 00 00 00 00
    00000030: 00 00 00 00 00 00 00 00 00 00 00 00 00 00 00 00
    00000040: 00 00 00 00 00 00 00 00 00 00 00 00 00 00 00 00
    00000050: 00 00 00 00 00 00 00 00 00 00 00 00 00 00 00 00
    00000060: 00 00 00 00 00 00 00 00 00 00 00 00 00 00 00 00
    00000070: 00 00 00 00 00 00 00 00 00 00 00 00 00 00 00 00
    00000080: 00 00 00 00 00 80 dc 7e
  UrbLink              = 00000000
[57640 ms] UsbSnoop - MyInternalIOCTLCompletion(a906b126) : fido=868fdb38, Irp=85ecee28, Context=86c46db0, IRQL=2
[57640 ms]  <<<  URB 23 coming back  <<< 
-- URB_FUNCTION_BULK_OR_INTERRUPT_TRANSFER:
  PipeHandle           = 86d6450c [endpoint 0x00000004]
  TransferFlags        = 00000000 (USBD_TRANSFER_DIRECTION_OUT, ~USBD_SHORT_TRANSFER_OK)
  TransferBufferLength = 00000088
  TransferBuffer       = 86d284f0
  TransferBufferMDL    = 85f48aa0
  UrbLink              = 00000000
[57642 ms] UsbSnoop - MyInternalIOCTLCompletion(a906b126) : fido=00000000, Irp=85efde48, Context=86ca63e8, IRQL=2
[57642 ms]  <<<  URB 22 coming back  <<< 
-- URB_FUNCTION_BULK_OR_INTERRUPT_TRANSFER:
  PipeHandle           = 86d644ec [endpoint 0x00000084]
  TransferFlags        = 00000003 (USBD_TRANSFER_DIRECTION_IN, USBD_SHORT_TRANSFER_OK)
  TransferBufferLength = 00000088
  TransferBuffer       = 85e7d370
  TransferBufferMDL    = 86cf8840
    00000000: 26 21 00 01 e7 03 e7 03 00 00 00 00 00 00 00 00
    00000010: 00 00 00 00 00 00 00 00 00 00 00 00 00 00 00 00
    00000020: 00 00 00 00 00 00 00 00 00 00 00 00 00 00 00 00
    00000030: 00 00 00 00 00 00 00 00 00 00 00 00 00 00 00 00
    00000040: 00 00 00 00 00 00 00 00 00 00 00 00 00 00 00 00
    00000050: 00 00 00 00 00 00 00 00 00 00 00 00 00 00 00 00
    00000060: 00 00 00 00 00 00 00 00 00 00 00 00 00 00 00 00
    00000070: 00 00 00 00 00 00 00 00 00 00 00 00 00 00 00 00
    00000080: 00 00 00 00 00 4a 7c 7e
  UrbLink              = 00000000
[57642 ms] UsbSnoop - FilterDispatchAny(a906afd2) : IRP_MJ_INTERNAL_DEVICE_CONTROL
[57642 ms] UsbSnoop - FdoHookDispatchInternalIoctl(a906b1ea) : fdo=8625f508, Irp=85efde48, IRQL=2
[57642 ms]  >>>  URB 24 going down  >>> 
-- URB_FUNCTION_BULK_OR_INTERRUPT_TRANSFER:
  PipeHandle           = 86d644ec [endpoint 0x00000084]
  TransferFlags        = 00000003 (USBD_TRANSFER_DIRECTION_IN, USBD_SHORT_TRANSFER_OK)
  TransferBufferLength = 00001000
  TransferBuffer       = 85e7d3f8
  TransferBufferMDL    = 00000000
  UrbLink              = 00000000
[57644 ms] UsbSnoop - FilterDispatchAny(a906afd2) : IRP_MJ_INTERNAL_DEVICE_CONTROL
[57644 ms] UsbSnoop - FdoHookDispatchInternalIoctl(a906b1ea) : fdo=8625f508, Irp=85ecee28, IRQL=0
[57644 ms]  >>>  URB 25 going down  >>> 
-- URB_FUNCTION_BULK_OR_INTERRUPT_TRANSFER:
  PipeHandle           = 86d6450c [endpoint 0x00000004]
  TransferFlags        = 00000000 (USBD_TRANSFER_DIRECTION_OUT, ~USBD_SHORT_TRANSFER_OK)
  TransferBufferLength = 00000088
  TransferBuffer       = 86d284f0
  TransferBufferMDL    = 00000000
    00000000: 26 20 00 01 00 00 00 00 00 00 00 00 00 00 00 00
    00000010: 00 00 00 00 00 00 00 00 00 00 00 00 00 00 00 00
    00000020: 00 00 00 00 00 00 00 00 00 00 00 00 00 00 00 00
    00000030: 00 00 00 00 00 00 00 00 00 00 00 00 00 00 00 00
    00000040: 00 00 00 00 00 00 00 00 00 00 00 00 00 00 00 00
    00000050: 00 00 00 00 00 00 00 00 00 00 00 00 00 00 00 00
    00000060: 00 00 00 00 00 00 00 00 00 00 00 00 00 00 00 00
    00000070: 00 00 00 00 00 00 00 00 00 00 00 00 00 00 00 00
    00000080: 00 00 00 00 00 a1 42 7e
  UrbLink              = 00000000
[57645 ms] UsbSnoop - MyInternalIOCTLCompletion(a906b126) : fido=868fdb38, Irp=85ecee28, Context=86c46db0, IRQL=2
[57645 ms]  <<<  URB 25 coming back  <<< 
-- URB_FUNCTION_BULK_OR_INTERRUPT_TRANSFER:
  PipeHandle           = 86d6450c [endpoint 0x00000004]
  TransferFlags        = 00000000 (USBD_TRANSFER_DIRECTION_OUT, ~USBD_SHORT_TRANSFER_OK)
  TransferBufferLength = 00000088
  TransferBuffer       = 86d284f0
  TransferBufferMDL    = 86cf4150
  UrbLink              = 00000000
[57647 ms] UsbSnoop - MyInternalIOCTLCompletion(a906b126) : fido=00000000, Irp=85efde48, Context=86ca63e8, IRQL=2
[57647 ms]  <<<  URB 24 coming back  <<< 
-- URB_FUNCTION_BULK_OR_INTERRUPT_TRANSFER:
  PipeHandle           = 86d644ec [endpoint 0x00000084]
  TransferFlags        = 00000003 (USBD_TRANSFER_DIRECTION_IN, USBD_SHORT_TRANSFER_OK)
  TransferBufferLength = 00000088
  TransferBuffer       = 85e7d3f8
  TransferBufferMDL    = 86cf8840
    00000000: 26 20 00 01 59 eb f9 00 59 eb f9 00 00 00 00 00
    00000010: 00 00 00 00 00 00 00 00 00 00 00 00 00 00 00 00
    00000020: 00 00 00 00 00 00 00 00 00 00 00 00 00 00 00 00
    00000030: 00 00 00 00 00 00 00 00 00 00 00 00 00 00 00 00
    00000040: 00 00 00 00 00 00 00 00 00 00 00 00 00 00 00 00
    00000050: 00 00 00 00 00 00 00 00 00 00 00 00 00 00 00 00
    00000060: 00 00 00 00 00 00 00 00 00 00 00 00 00 00 00 00
    00000070: 00 00 00 00 00 00 00 00 00 00 00 00 00 00 00 00
    00000080: 00 00 00 00 00 d8 45 7e
  UrbLink              = 00000000
[57647 ms] UsbSnoop - FilterDispatchAny(a906afd2) : IRP_MJ_INTERNAL_DEVICE_CONTROL
[57647 ms] UsbSnoop - FdoHookDispatchInternalIoctl(a906b1ea) : fdo=8625f508, Irp=85efde48, IRQL=2
[57647 ms]  >>>  URB 26 going down  >>> 
-- URB_FUNCTION_BULK_OR_INTERRUPT_TRANSFER:
  PipeHandle           = 86d644ec [endpoint 0x00000084]
  TransferFlags        = 00000003 (USBD_TRANSFER_DIRECTION_IN, USBD_SHORT_TRANSFER_OK)
  TransferBufferLength = 00001000
  TransferBuffer       = 85e7d480
  TransferBufferMDL    = 00000000
  UrbLink              = 00000000
[57649 ms] UsbSnoop - FilterDispatchAny(a906afd2) : IRP_MJ_INTERNAL_DEVICE_CONTROL
[57649 ms] UsbSnoop - FdoHookDispatchInternalIoctl(a906b1ea) : fdo=8625f508, Irp=85ecee28, IRQL=0
[57649 ms]  >>>  URB 27 going down  >>> 
-- URB_FUNCTION_BULK_OR_INTERRUPT_TRANSFER:
  PipeHandle           = 86d6450c [endpoint 0x00000004]
  TransferFlags        = 00000000 (USBD_TRANSFER_DIRECTION_OUT, ~USBD_SHORT_TRANSFER_OK)
  TransferBufferLength = 00000088
  TransferBuffer       = 86d284f0
  TransferBufferMDL    = 00000000
    00000000: 26 00 01 01 00 00 00 00 00 00 00 00 00 00 00 00
    00000010: 00 00 00 00 00 00 00 00 00 00 00 00 00 00 00 00
    00000020: 00 00 00 00 00 00 00 00 00 00 00 00 00 00 00 00
    00000030: 00 00 00 00 00 00 00 00 00 00 00 00 00 00 00 00
    00000040: 00 00 00 00 00 00 00 00 00 00 00 00 00 00 00 00
    00000050: 00 00 00 00 00 00 00 00 00 00 00 00 00 00 00 00
    00000060: 00 00 00 00 00 00 00 00 00 00 00 00 00 00 00 00
    00000070: 00 00 00 00 00 00 00 00 00 00 00 00 00 00 00 00
    00000080: 00 00 00 00 00 98 e7 7e
  UrbLink              = 00000000
[57650 ms] UsbSnoop - MyInternalIOCTLCompletion(a906b126) : fido=868fdb38, Irp=85ecee28, Context=86c46db0, IRQL=2
[57650 ms]  <<<  URB 27 coming back  <<< 
-- URB_FUNCTION_BULK_OR_INTERRUPT_TRANSFER:
  PipeHandle           = 86d6450c [endpoint 0x00000004]
  TransferFlags        = 00000000 (USBD_TRANSFER_DIRECTION_OUT, ~USBD_SHORT_TRANSFER_OK)
  TransferBufferLength = 00000088
  TransferBuffer       = 86d284f0
  TransferBufferMDL    = 86bdc8e0
  UrbLink              = 00000000
[57672 ms] UsbSnoop - MyInternalIOCTLCompletion(a906b126) : fido=00000000, Irp=85efde48, Context=86ca63e8, IRQL=2
[57672 ms]  <<<  URB 26 coming back  <<< 
-- URB_FUNCTION_BULK_OR_INTERRUPT_TRANSFER:
  PipeHandle           = 86d644ec [endpoint 0x00000084]
  TransferFlags        = 00000003 (USBD_TRANSFER_DIRECTION_IN, USBD_SHORT_TRANSFER_OK)
  TransferBufferLength = 00000088
  TransferBuffer       = 85e7d480
  TransferBufferMDL    = 86cf8840
    00000000: 26 00 01 01 01 00 00 00 00 00 00 00 00 00 00 00
    00000010: 00 00 00 00 00 00 00 00 00 00 00 00 00 00 00 00
    00000020: 00 00 00 00 00 00 00 00 00 00 00 00 00 00 00 00
    00000030: 00 00 00 00 00 00 00 00 00 00 00 00 00 00 00 00
    00000040: 00 00 00 00 00 00 00 00 00 00 00 00 00 00 00 00
    00000050: 00 00 00 00 00 00 00 00 00 00 00 00 00 00 00 00
    00000060: 00 00 00 00 00 00 00 00 00 00 00 00 00 00 00 00
    00000070: 00 00 00 00 00 00 00 00 00 00 00 00 00 00 00 00
    00000080: 00 00 00 00 00 e3 bc 7e
  UrbLink              = 00000000
[57672 ms] UsbSnoop - FilterDispatchAny(a906afd2) : IRP_MJ_INTERNAL_DEVICE_CONTROL
[57672 ms] UsbSnoop - FdoHookDispatchInternalIoctl(a906b1ea) : fdo=8625f508, Irp=85efde48, IRQL=2
[57672 ms]  >>>  URB 28 going down  >>> 
-- URB_FUNCTION_BULK_OR_INTERRUPT_TRANSFER:
  PipeHandle           = 86d644ec [endpoint 0x00000084]
  TransferFlags        = 00000003 (USBD_TRANSFER_DIRECTION_IN, USBD_SHORT_TRANSFER_OK)
  TransferBufferLength = 00001000
  TransferBuffer       = 85e7d508
  TransferBufferMDL    = 00000000
  UrbLink              = 00000000
[57672 ms] UsbSnoop - FilterDispatchAny(a906afd2) : IRP_MJ_INTERNAL_DEVICE_CONTROL
[57672 ms] UsbSnoop - FdoHookDispatchInternalIoctl(a906b1ea) : fdo=8625f508, Irp=85ecee28, IRQL=0
[57672 ms]  >>>  URB 29 going down  >>> 
-- URB_FUNCTION_BULK_OR_INTERRUPT_TRANSFER:
  PipeHandle           = 86d6450c [endpoint 0x00000004]
  TransferFlags        = 00000000 (USBD_TRANSFER_DIRECTION_OUT, ~USBD_SHORT_TRANSFER_OK)
  TransferBufferLength = 00000088
  TransferBuffer       = 86d284f0
  TransferBufferMDL    = 00000000
    00000000: 26 04 01 01 00 00 00 00 00 00 00 00 00 00 00 00
    00000010: 00 00 00 00 00 00 00 00 00 00 00 00 00 00 00 00
    00000020: 00 00 00 00 00 00 00 00 00 00 00 00 00 00 00 00
    00000030: 00 00 00 00 00 00 00 00 00 00 00 00 00 00 00 00
    00000040: 00 00 00 00 00 00 00 00 00 00 00 00 00 00 00 00
    00000050: 00 00 00 00 00 00 00 00 00 00 00 00 00 00 00 00
    00000060: 00 00 00 00 00 00 00 00 00 00 00 00 00 00 00 00
    00000070: 00 00 00 00 00 00 00 00 00 00 00 00 00 00 00 00
    00000080: 00 00 00 00 00 3e 8f 7e
  UrbLink              = 00000000
[57673 ms] UsbSnoop - MyInternalIOCTLCompletion(a906b126) : fido=868fdb38, Irp=85ecee28, Context=86c46db0, IRQL=2
[57673 ms]  <<<  URB 29 coming back  <<< 
-- URB_FUNCTION_BULK_OR_INTERRUPT_TRANSFER:
  PipeHandle           = 86d6450c [endpoint 0x00000004]
  TransferFlags        = 00000000 (USBD_TRANSFER_DIRECTION_OUT, ~USBD_SHORT_TRANSFER_OK)
  TransferBufferLength = 00000088
  TransferBuffer       = 86d284f0
  TransferBufferMDL    = 86bdc8e0
  UrbLink              = 00000000
[57675 ms] UsbSnoop - MyInternalIOCTLCompletion(a906b126) : fido=00000000, Irp=85efde48, Context=86ca63e8, IRQL=2
[57675 ms]  <<<  URB 28 coming back  <<< 
-- URB_FUNCTION_BULK_OR_INTERRUPT_TRANSFER:
  PipeHandle           = 86d644ec [endpoint 0x00000084]
  TransferFlags        = 00000003 (USBD_TRANSFER_DIRECTION_IN, USBD_SHORT_TRANSFER_OK)
  TransferBufferLength = 00000088
  TransferBuffer       = 85e7d508
  TransferBufferMDL    = 86cf8840
    00000000: 26 04 01 01 01 00 00 00 00 00 00 00 00 00 00 00
    00000010: 00 00 00 00 00 00 00 00 00 00 00 00 00 00 00 00
    00000020: 00 00 00 00 00 00 00 00 00 00 00 00 00 00 00 00
    00000030: 00 00 00 00 00 00 00 00 00 00 00 00 00 00 00 00
    00000040: 00 00 00 00 00 00 00 00 00 00 00 00 00 00 00 00
    00000050: 00 00 00 00 00 00 00 00 00 00 00 00 00 00 00 00
    00000060: 00 00 00 00 00 00 00 00 00 00 00 00 00 00 00 00
    00000070: 00 00 00 00 00 00 00 00 00 00 00 00 00 00 00 00
    00000080: 00 00 00 00 00 45 d4 7e
  UrbLink              = 00000000
[57675 ms] UsbSnoop - FilterDispatchAny(a906afd2) : IRP_MJ_INTERNAL_DEVICE_CONTROL
[57675 ms] UsbSnoop - FdoHookDispatchInternalIoctl(a906b1ea) : fdo=8625f508, Irp=85efde48, IRQL=2
[57675 ms]  >>>  URB 30 going down  >>> 
-- URB_FUNCTION_BULK_OR_INTERRUPT_TRANSFER:
  PipeHandle           = 86d644ec [endpoint 0x00000084]
  TransferFlags        = 00000003 (USBD_TRANSFER_DIRECTION_IN, USBD_SHORT_TRANSFER_OK)
  TransferBufferLength = 00001000
  TransferBuffer       = 85e7d590
  TransferBufferMDL    = 00000000
  UrbLink              = 00000000
[57675 ms] UsbSnoop - FilterDispatchAny(a906afd2) : IRP_MJ_INTERNAL_DEVICE_CONTROL
[57675 ms] UsbSnoop - FdoHookDispatchInternalIoctl(a906b1ea) : fdo=8625f508, Irp=85ecee28, IRQL=0
[57675 ms]  >>>  URB 31 going down  >>> 
-- URB_FUNCTION_BULK_OR_INTERRUPT_TRANSFER:
  PipeHandle           = 86d6450c [endpoint 0x00000004]
  TransferFlags        = 00000000 (USBD_TRANSFER_DIRECTION_OUT, ~USBD_SHORT_TRANSFER_OK)
  TransferBufferLength = 00000088
  TransferBuffer       = 86d284f0
  TransferBufferMDL    = 00000000
    00000000: 26 b2 00 01 00 00 00 00 00 00 00 00 00 00 00 00
    00000010: 00 00 00 00 00 00 00 00 00 00 00 00 00 00 00 00
    00000020: 00 00 00 00 00 00 00 00 00 00 00 00 00 00 00 00
    00000030: 00 00 00 00 00 00 00 00 00 00 00 00 00 00 00 00
    00000040: 00 00 00 00 00 00 00 00 00 00 00 00 00 00 00 00
    00000050: 00 00 00 00 00 00 00 00 00 00 00 00 00 00 00 00
    00000060: 00 00 00 00 00 00 00 00 00 00 00 00 00 00 00 00
    00000070: 00 00 00 00 00 00 00 00 00 00 00 00 00 00 00 00
    00000080: 00 00 00 00 00 66 a0 7e
  UrbLink              = 00000000
[57676 ms] UsbSnoop - MyInternalIOCTLCompletion(a906b126) : fido=868fdb38, Irp=85ecee28, Context=86c46db0, IRQL=2
[57676 ms]  <<<  URB 31 coming back  <<< 
-- URB_FUNCTION_BULK_OR_INTERRUPT_TRANSFER:
  PipeHandle           = 86d6450c [endpoint 0x00000004]
  TransferFlags        = 00000000 (USBD_TRANSFER_DIRECTION_OUT, ~USBD_SHORT_TRANSFER_OK)
  TransferBufferLength = 00000088
  TransferBuffer       = 86d284f0
  TransferBufferMDL    = 86bdc8e0
  UrbLink              = 00000000
[57678 ms] UsbSnoop - MyInternalIOCTLCompletion(a906b126) : fido=00000000, Irp=85efde48, Context=86ca63e8, IRQL=2
[57678 ms]  <<<  URB 30 coming back  <<< 
-- URB_FUNCTION_BULK_OR_INTERRUPT_TRANSFER:
  PipeHandle           = 86d644ec [endpoint 0x00000084]
  TransferFlags        = 00000003 (USBD_TRANSFER_DIRECTION_IN, USBD_SHORT_TRANSFER_OK)
  TransferBufferLength = 00000088
  TransferBuffer       = 85e7d590
  TransferBufferMDL    = 86cf8840
    00000000: 26 b2 00 01 30 30 30 30 30 30 30 39 36 38 00 00
    00000010: 00 00 00 00 00 00 00 00 00 00 00 00 00 00 00 00
    00000020: 00 00 00 00 00 00 00 00 00 00 00 00 00 00 00 00
    00000030: 00 00 00 00 00 00 00 00 00 00 00 00 00 00 00 00
    00000040: 00 00 00 00 00 00 00 00 00 00 00 00 00 00 00 00
    00000050: 00 00 00 00 00 00 00 00 00 00 00 00 00 00 00 00
    00000060: 00 00 00 00 00 00 00 00 00 00 00 00 00 00 00 00
    00000070: 00 00 00 00 00 00 00 00 00 00 00 00 00 00 00 00
    00000080: 00 00 00 00 00 c1 db 7e
  UrbLink              = 00000000
[57678 ms] UsbSnoop - FilterDispatchAny(a906afd2) : IRP_MJ_INTERNAL_DEVICE_CONTROL
[57678 ms] UsbSnoop - FdoHookDispatchInternalIoctl(a906b1ea) : fdo=8625f508, Irp=85efde48, IRQL=2
[57678 ms]  >>>  URB 32 going down  >>> 
-- URB_FUNCTION_BULK_OR_INTERRUPT_TRANSFER:
  PipeHandle           = 86d644ec [endpoint 0x00000084]
  TransferFlags        = 00000003 (USBD_TRANSFER_DIRECTION_IN, USBD_SHORT_TRANSFER_OK)
  TransferBufferLength = 00001000
  TransferBuffer       = 85e7d618
  TransferBufferMDL    = 00000000
  UrbLink              = 00000000
[57678 ms] UsbSnoop - FilterDispatchAny(a906afd2) : IRP_MJ_INTERNAL_DEVICE_CONTROL
[57678 ms] UsbSnoop - FdoHookDispatchInternalIoctl(a906b1ea) : fdo=8625f508, Irp=85ecee28, IRQL=0
[57678 ms]  >>>  URB 33 going down  >>> 
-- URB_FUNCTION_BULK_OR_INTERRUPT_TRANSFER:
  PipeHandle           = 86d6450c [endpoint 0x00000004]
  TransferFlags        = 00000000 (USBD_TRANSFER_DIRECTION_OUT, ~USBD_SHORT_TRANSFER_OK)
  TransferBufferLength = 00000088
  TransferBuffer       = 86d284f0
  TransferBufferMDL    = 00000000
    00000000: 26 14 00 01 00 00 00 00 00 00 00 00 00 00 00 00
    00000010: 00 00 00 00 00 00 00 00 00 00 00 00 00 00 00 00
    00000020: 00 00 00 00 00 00 00 00 00 00 00 00 00 00 00 00
    00000030: 00 00 00 00 00 00 00 00 00 00 00 00 00 00 00 00
    00000040: 00 00 00 00 00 00 00 00 00 00 00 00 00 00 00 00
    00000050: 00 00 00 00 00 00 00 00 00 00 00 00 00 00 00 00
    00000060: 00 00 00 00 00 00 00 00 00 00 00 00 00 00 00 00
    00000070: 00 00 00 00 00 00 00 00 00 00 00 00 00 00 00 00
    00000080: 00 00 00 00 00 8d dd 7e
  UrbLink              = 00000000
[57679 ms] UsbSnoop - MyInternalIOCTLCompletion(a906b126) : fido=868fdb38, Irp=85ecee28, Context=86c46db0, IRQL=2
[57679 ms]  <<<  URB 33 coming back  <<< 
-- URB_FUNCTION_BULK_OR_INTERRUPT_TRANSFER:
  PipeHandle           = 86d6450c [endpoint 0x00000004]
  TransferFlags        = 00000000 (USBD_TRANSFER_DIRECTION_OUT, ~USBD_SHORT_TRANSFER_OK)
  TransferBufferLength = 00000088
  TransferBuffer       = 86d284f0
  TransferBufferMDL    = 86bdc8e0
  UrbLink              = 00000000
[57681 ms] UsbSnoop - MyInternalIOCTLCompletion(a906b126) : fido=00000000, Irp=85efde48, Context=86ca63e8, IRQL=2
[57681 ms]  <<<  URB 32 coming back  <<< 
-- URB_FUNCTION_BULK_OR_INTERRUPT_TRANSFER:
  PipeHandle           = 86d644ec [endpoint 0x00000084]
  TransferFlags        = 00000003 (USBD_TRANSFER_DIRECTION_IN, USBD_SHORT_TRANSFER_OK)
  TransferBufferLength = 00000088
  TransferBuffer       = 85e7d618
  TransferBufferMDL    = 86cf8840
    00000000: 26 14 00 01 1b 01 80 01 00 00 00 00 00 00 00 00
    00000010: 00 00 00 00 00 00 00 00 00 00 00 00 00 00 00 00
    00000020: 00 00 00 00 00 00 00 00 00 00 00 00 00 00 00 00
    00000030: 00 00 00 00 00 00 00 00 00 00 00 00 00 00 00 00
    00000040: 00 00 00 00 00 00 00 00 00 00 00 00 00 00 00 00
    00000050: 00 00 00 00 00 00 00 00 00 00 00 00 00 00 00 00
    00000060: 00 00 00 00 00 00 00 00 00 00 00 00 00 00 00 00
    00000070: 00 00 00 00 00 00 00 00 00 00 00 00 00 00 00 00
    00000080: 00 00 00 00 00 62 b7 7e
  UrbLink              = 00000000
[57681 ms] UsbSnoop - FilterDispatchAny(a906afd2) : IRP_MJ_INTERNAL_DEVICE_CONTROL
[57681 ms] UsbSnoop - FdoHookDispatchInternalIoctl(a906b1ea) : fdo=8625f508, Irp=85efde48, IRQL=2
[57681 ms]  >>>  URB 34 going down  >>> 
-- URB_FUNCTION_BULK_OR_INTERRUPT_TRANSFER:
  PipeHandle           = 86d644ec [endpoint 0x00000084]
  TransferFlags        = 00000003 (USBD_TRANSFER_DIRECTION_IN, USBD_SHORT_TRANSFER_OK)
  TransferBufferLength = 00001000
  TransferBuffer       = 85e7d6a0
  TransferBufferMDL    = 00000000
  UrbLink              = 00000000
[57681 ms] UsbSnoop - FilterDispatchAny(a906afd2) : IRP_MJ_INTERNAL_DEVICE_CONTROL
[57681 ms] UsbSnoop - FdoHookDispatchInternalIoctl(a906b1ea) : fdo=8625f508, Irp=85ecee28, IRQL=0
[57681 ms]  >>>  URB 35 going down  >>> 
-- URB_FUNCTION_BULK_OR_INTERRUPT_TRANSFER:
  PipeHandle           = 86d6450c [endpoint 0x00000004]
  TransferFlags        = 00000000 (USBD_TRANSFER_DIRECTION_OUT, ~USBD_SHORT_TRANSFER_OK)
  TransferBufferLength = 00000088
  TransferBuffer       = 86d284f0
  TransferBufferMDL    = 00000000
    00000000: 26 15 00 01 00 00 00 00 00 00 00 00 00 00 00 00
    00000010: 00 00 00 00 00 00 00 00 00 00 00 00 00 00 00 00
    00000020: 00 00 00 00 00 00 00 00 00 00 00 00 00 00 00 00
    00000030: 00 00 00 00 00 00 00 00 00 00 00 00 00 00 00 00
    00000040: 00 00 00 00 00 00 00 00 00 00 00 00 00 00 00 00
    00000050: 00 00 00 00 00 00 00 00 00 00 00 00 00 00 00 00
    00000060: 00 00 00 00 00 00 00 00 00 00 00 00 00 00 00 00
    00000070: 00 00 00 00 00 00 00 00 00 00 00 00 00 00 00 00
    00000080: 00 00 00 00 00 ac 43 7e
  UrbLink              = 00000000
[57682 ms] UsbSnoop - MyInternalIOCTLCompletion(a906b126) : fido=868fdb38, Irp=85ecee28, Context=86c46db0, IRQL=2
[57682 ms]  <<<  URB 35 coming back  <<< 
-- URB_FUNCTION_BULK_OR_INTERRUPT_TRANSFER:
  PipeHandle           = 86d6450c [endpoint 0x00000004]
  TransferFlags        = 00000000 (USBD_TRANSFER_DIRECTION_OUT, ~USBD_SHORT_TRANSFER_OK)
  TransferBufferLength = 00000088
  TransferBuffer       = 86d284f0
  TransferBufferMDL    = 86bdc8e0
  UrbLink              = 00000000
[57685 ms] UsbSnoop - MyInternalIOCTLCompletion(a906b126) : fido=00000000, Irp=85efde48, Context=86ca63e8, IRQL=2
[57685 ms]  <<<  URB 34 coming back  <<< 
-- URB_FUNCTION_BULK_OR_INTERRUPT_TRANSFER:
  PipeHandle           = 86d644ec [endpoint 0x00000084]
  TransferFlags        = 00000003 (USBD_TRANSFER_DIRECTION_IN, USBD_SHORT_TRANSFER_OK)
  TransferBufferLength = 00000088
  TransferBuffer       = 85e7d6a0
  TransferBufferMDL    = 86cf8840
    00000000: 26 15 00 01 b3 02 09 03 00 00 00 00 00 00 00 00
    00000010: 00 00 00 00 00 00 00 00 00 00 00 00 00 00 00 00
    00000020: 00 00 00 00 00 00 00 00 00 00 00 00 00 00 00 00
    00000030: 00 00 00 00 00 00 00 00 00 00 00 00 00 00 00 00
    00000040: 00 00 00 00 00 00 00 00 00 00 00 00 00 00 00 00
    00000050: 00 00 00 00 00 00 00 00 00 00 00 00 00 00 00 00
    00000060: 00 00 00 00 00 00 00 00 00 00 00 00 00 00 00 00
    00000070: 00 00 00 00 00 00 00 00 00 00 00 00 00 00 00 00
    00000080: 00 00 00 00 00 21 e9 7e
  UrbLink              = 00000000
[57685 ms] UsbSnoop - FilterDispatchAny(a906afd2) : IRP_MJ_INTERNAL_DEVICE_CONTROL
[57685 ms] UsbSnoop - FdoHookDispatchInternalIoctl(a906b1ea) : fdo=8625f508, Irp=85efde48, IRQL=2
[57685 ms]  >>>  URB 36 going down  >>> 
-- URB_FUNCTION_BULK_OR_INTERRUPT_TRANSFER:
  PipeHandle           = 86d644ec [endpoint 0x00000084]
  TransferFlags        = 00000003 (USBD_TRANSFER_DIRECTION_IN, USBD_SHORT_TRANSFER_OK)
  TransferBufferLength = 00001000
  TransferBuffer       = 85e7d728
  TransferBufferMDL    = 00000000
  UrbLink              = 00000000
[57685 ms] UsbSnoop - FilterDispatchAny(a906afd2) : IRP_MJ_INTERNAL_DEVICE_CONTROL
[57685 ms] UsbSnoop - FdoHookDispatchInternalIoctl(a906b1ea) : fdo=8625f508, Irp=86c8f670, IRQL=0
[57685 ms]  >>>  URB 37 going down  >>> 
-- URB_FUNCTION_BULK_OR_INTERRUPT_TRANSFER:
  PipeHandle           = 86d6450c [endpoint 0x00000004]
  TransferFlags        = 00000000 (USBD_TRANSFER_DIRECTION_OUT, ~USBD_SHORT_TRANSFER_OK)
  TransferBufferLength = 00000088
  TransferBuffer       = 86d284f0
  TransferBufferMDL    = 00000000
    00000000: 26 03 01 01 00 00 00 00 00 00 00 00 00 00 00 00
    00000010: 00 00 00 00 00 00 00 00 00 00 00 00 00 00 00 00
    00000020: 00 00 00 00 00 00 00 00 00 00 00 00 00 00 00 00
    00000030: 00 00 00 00 00 00 00 00 00 00 00 00 00 00 00 00
    00000040: 00 00 00 00 00 00 00 00 00 00 00 00 00 00 00 00
    00000050: 00 00 00 00 00 00 00 00 00 00 00 00 00 00 00 00
    00000060: 00 00 00 00 00 00 00 00 00 00 00 00 00 00 00 00
    00000070: 00 00 00 00 00 00 00 00 00 00 00 00 00 00 00 00
    00000080: 00 00 00 00 00 ea 4d 7e
  UrbLink              = 00000000
[57686 ms] UsbSnoop - MyInternalIOCTLCompletion(a906b126) : fido=868fdb38, Irp=86c8f670, Context=86c46db0, IRQL=2
[57686 ms]  <<<  URB 37 coming back  <<< 
-- URB_FUNCTION_BULK_OR_INTERRUPT_TRANSFER:
  PipeHandle           = 86d6450c [endpoint 0x00000004]
  TransferFlags        = 00000000 (USBD_TRANSFER_DIRECTION_OUT, ~USBD_SHORT_TRANSFER_OK)
  TransferBufferLength = 00000088
  TransferBuffer       = 86d284f0
  TransferBufferMDL    = 85f1b318
  UrbLink              = 00000000
[57688 ms] UsbSnoop - MyInternalIOCTLCompletion(a906b126) : fido=00000000, Irp=85efde48, Context=86ca63e8, IRQL=2
[57688 ms]  <<<  URB 36 coming back  <<< 
-- URB_FUNCTION_BULK_OR_INTERRUPT_TRANSFER:
  PipeHandle           = 86d644ec [endpoint 0x00000084]
  TransferFlags        = 00000003 (USBD_TRANSFER_DIRECTION_IN, USBD_SHORT_TRANSFER_OK)
  TransferBufferLength = 00000088
  TransferBuffer       = 85e7d728
  TransferBufferMDL    = 86cf8840
    00000000: 26 03 01 01 00 00 ff ff 00 00 ff ff 00 00 ff ff
    00000010: 00 00 ff ff 00 00 ff ff 00 00 ff ff 00 00 ff ff
    00000020: 00 00 ff ff 00 00 ff ff 00 00 ff ff 00 00 ff ff
    00000030: 00 00 ff ff 00 00 ff ff 00 00 ff ff 00 00 ff ff
    00000040: 00 00 ff ff 00 00 ff ff 00 00 ff ff 00 00 ff ff
    00000050: 00 00 ff ff 00 00 00 00 00 00 00 00 00 00 00 00
    00000060: 00 00 00 00 00 00 00 00 00 00 00 00 00 00 00 00
    00000070: 00 00 00 00 00 00 00 00 00 00 00 00 00 00 00 00
    00000080: 00 00 00 00 00 78 f8 7e
  UrbLink              = 00000000
[57688 ms] UsbSnoop - FilterDispatchAny(a906afd2) : IRP_MJ_INTERNAL_DEVICE_CONTROL
[57688 ms] UsbSnoop - FdoHookDispatchInternalIoctl(a906b1ea) : fdo=8625f508, Irp=85efde48, IRQL=2
[57688 ms]  >>>  URB 38 going down  >>> 
-- URB_FUNCTION_BULK_OR_INTERRUPT_TRANSFER:
  PipeHandle           = 86d644ec [endpoint 0x00000084]
  TransferFlags        = 00000003 (USBD_TRANSFER_DIRECTION_IN, USBD_SHORT_TRANSFER_OK)
  TransferBufferLength = 00001000
  TransferBuffer       = 85e7d7b0
  TransferBufferMDL    = 00000000
  UrbLink              = 00000000
[57689 ms] UsbSnoop - FilterDispatchAny(a906afd2) : IRP_MJ_INTERNAL_DEVICE_CONTROL
[57689 ms] UsbSnoop - FdoHookDispatchInternalIoctl(a906b1ea) : fdo=8625f508, Irp=86c8f670, IRQL=0
[57689 ms]  >>>  URB 39 going down  >>> 
-- URB_FUNCTION_BULK_OR_INTERRUPT_TRANSFER:
  PipeHandle           = 86d6450c [endpoint 0x00000004]
  TransferFlags        = 00000000 (USBD_TRANSFER_DIRECTION_OUT, ~USBD_SHORT_TRANSFER_OK)
  TransferBufferLength = 00000088
  TransferBuffer       = 86d284f0
  TransferBufferMDL    = 00000000
    00000000: 26 02 01 01 00 00 00 00 00 00 00 00 00 00 00 00
    00000010: 00 00 00 00 00 00 00 00 00 00 00 00 00 00 00 00
    00000020: 00 00 00 00 00 00 00 00 00 00 00 00 00 00 00 00
    00000030: 00 00 00 00 00 00 00 00 00 00 00 00 00 00 00 00
    00000040: 00 00 00 00 00 00 00 00 00 00 00 00 00 00 00 00
    00000050: 00 00 00 00 00 00 00 00 00 00 00 00 00 00 00 00
    00000060: 00 00 00 00 00 00 00 00 00 00 00 00 00 00 00 00
    00000070: 00 00 00 00 00 00 00 00 00 00 00 00 00 00 00 00
    00000080: 00 00 00 00 00 cb d3 7e
  UrbLink              = 00000000
[57691 ms] UsbSnoop - MyInternalIOCTLCompletion(a906b126) : fido=868fdb38, Irp=86c8f670, Context=86c46db0, IRQL=2
[57691 ms]  <<<  URB 39 coming back  <<< 
-- URB_FUNCTION_BULK_OR_INTERRUPT_TRANSFER:
  PipeHandle           = 86d6450c [endpoint 0x00000004]
  TransferFlags        = 00000000 (USBD_TRANSFER_DIRECTION_OUT, ~USBD_SHORT_TRANSFER_OK)
  TransferBufferLength = 00000088
  TransferBuffer       = 86d284f0
  TransferBufferMDL    = 86b55150
  UrbLink              = 00000000
[57692 ms] UsbSnoop - MyInternalIOCTLCompletion(a906b126) : fido=00000000, Irp=85efde48, Context=86ca63e8, IRQL=2
[57692 ms]  <<<  URB 38 coming back  <<< 
-- URB_FUNCTION_BULK_OR_INTERRUPT_TRANSFER:
  PipeHandle           = 86d644ec [endpoint 0x00000084]
  TransferFlags        = 00000003 (USBD_TRANSFER_DIRECTION_IN, USBD_SHORT_TRANSFER_OK)
  TransferBufferLength = 00000088
  TransferBuffer       = 85e7d7b0
  TransferBufferMDL    = 86cf8840
    00000000: 26 02 01 01 02 00 00 00 00 00 00 00 00 00 00 00
    00000010: 00 00 00 00 00 00 00 00 00 00 00 00 00 00 00 00
    00000020: 00 00 00 00 00 00 00 00 00 00 00 00 00 00 00 00
    00000030: 00 00 00 00 00 00 00 00 00 00 00 00 00 00 00 00
    00000040: 00 00 00 00 00 00 00 00 00 00 00 00 00 00 00 00
    00000050: 00 00 00 00 00 00 00 00 00 00 00 00 00 00 00 00
    00000060: 00 00 00 00 00 00 00 00 00 00 00 00 00 00 00 00
    00000070: 00 00 00 00 00 00 00 00 00 00 00 00 00 00 00 00
    00000080: 00 00 00 00 00 3d 65 7e
  UrbLink              = 00000000
[57692 ms] UsbSnoop - FilterDispatchAny(a906afd2) : IRP_MJ_INTERNAL_DEVICE_CONTROL
[57692 ms] UsbSnoop - FdoHookDispatchInternalIoctl(a906b1ea) : fdo=8625f508, Irp=85efde48, IRQL=2
[57692 ms]  >>>  URB 40 going down  >>> 
-- URB_FUNCTION_BULK_OR_INTERRUPT_TRANSFER:
  PipeHandle           = 86d644ec [endpoint 0x00000084]
  TransferFlags        = 00000003 (USBD_TRANSFER_DIRECTION_IN, USBD_SHORT_TRANSFER_OK)
  TransferBufferLength = 00001000
  TransferBuffer       = 85e7d838
  TransferBufferMDL    = 00000000
  UrbLink              = 00000000
[57692 ms] UsbSnoop - FilterDispatchAny(a906afd2) : IRP_MJ_INTERNAL_DEVICE_CONTROL
[57692 ms] UsbSnoop - FdoHookDispatchInternalIoctl(a906b1ea) : fdo=8625f508, Irp=86c8f670, IRQL=0
[57692 ms]  >>>  URB 41 going down  >>> 
-- URB_FUNCTION_BULK_OR_INTERRUPT_TRANSFER:
  PipeHandle           = 86d6450c [endpoint 0x00000004]
  TransferFlags        = 00000000 (USBD_TRANSFER_DIRECTION_OUT, ~USBD_SHORT_TRANSFER_OK)
  TransferBufferLength = 00000088
  TransferBuffer       = 86d284f0
  TransferBufferMDL    = 00000000
    00000000: 26 0a 00 01 00 00 00 00 00 00 00 00 00 00 00 00
    00000010: 00 00 00 00 00 00 00 00 00 00 00 00 00 00 00 00
    00000020: 00 00 00 00 00 00 00 00 00 00 00 00 00 00 00 00
    00000030: 00 00 00 00 00 00 00 00 00 00 00 00 00 00 00 00
    00000040: 00 00 00 00 00 00 00 00 00 00 00 00 00 00 00 00
    00000050: 00 00 00 00 00 00 00 00 00 00 00 00 00 00 00 00
    00000060: 00 00 00 00 00 00 00 00 00 00 00 00 00 00 00 00
    00000070: 00 00 00 00 00 00 00 00 00 00 00 00 00 00 00 00
    00000080: 00 00 00 00 00 bd fa 7e
  UrbLink              = 00000000
[57693 ms] UsbSnoop - MyInternalIOCTLCompletion(a906b126) : fido=868fdb38, Irp=86c8f670, Context=86c46db0, IRQL=2
[57693 ms]  <<<  URB 41 coming back  <<< 
-- URB_FUNCTION_BULK_OR_INTERRUPT_TRANSFER:
  PipeHandle           = 86d6450c [endpoint 0x00000004]
  TransferFlags        = 00000000 (USBD_TRANSFER_DIRECTION_OUT, ~USBD_SHORT_TRANSFER_OK)
  TransferBufferLength = 00000088
  TransferBuffer       = 86d284f0
  TransferBufferMDL    = 86bdc8e0
  UrbLink              = 00000000
[57695 ms] UsbSnoop - MyInternalIOCTLCompletion(a906b126) : fido=00000000, Irp=85efde48, Context=86ca63e8, IRQL=2
[57695 ms]  <<<  URB 40 coming back  <<< 
-- URB_FUNCTION_BULK_OR_INTERRUPT_TRANSFER:
  PipeHandle           = 86d644ec [endpoint 0x00000084]
  TransferFlags        = 00000003 (USBD_TRANSFER_DIRECTION_IN, USBD_SHORT_TRANSFER_OK)
  TransferBufferLength = 00000088
  TransferBuffer       = 85e7d838
  TransferBufferMDL    = 86cf8840
    00000000: 26 0a 00 01 04 00 00 00 00 00 00 00 00 00 00 00
    00000010: 00 00 00 00 00 00 00 00 00 00 00 00 00 00 00 00
    00000020: 00 00 00 00 00 00 00 00 00 00 00 00 00 00 00 00
    00000030: 00 00 00 00 00 00 00 00 00 00 00 00 00 00 00 00
    00000040: 00 00 00 00 00 00 00 00 00 00 00 00 00 00 00 00
    00000050: 00 00 00 00 00 00 00 00 00 00 00 00 00 00 00 00
    00000060: 00 00 00 00 00 00 00 00 00 00 00 00 00 00 00 00
    00000070: 00 00 00 00 00 00 00 00 00 00 00 00 00 00 00 00
    00000080: 00 00 00 00 00 40 9f 7e
  UrbLink              = 00000000
[57695 ms] UsbSnoop - FilterDispatchAny(a906afd2) : IRP_MJ_INTERNAL_DEVICE_CONTROL
[57695 ms] UsbSnoop - FdoHookDispatchInternalIoctl(a906b1ea) : fdo=8625f508, Irp=85efde48, IRQL=2
[57695 ms]  >>>  URB 42 going down  >>> 
-- URB_FUNCTION_BULK_OR_INTERRUPT_TRANSFER:
  PipeHandle           = 86d644ec [endpoint 0x00000084]
  TransferFlags        = 00000003 (USBD_TRANSFER_DIRECTION_IN, USBD_SHORT_TRANSFER_OK)
  TransferBufferLength = 00001000
  TransferBuffer       = 85e7d8c0
  TransferBufferMDL    = 00000000
  UrbLink              = 00000000
[57695 ms] UsbSnoop - FilterDispatchAny(a906afd2) : IRP_MJ_INTERNAL_DEVICE_CONTROL
[57695 ms] UsbSnoop - FdoHookDispatchInternalIoctl(a906b1ea) : fdo=8625f508, Irp=86c8f670, IRQL=0
[57695 ms]  >>>  URB 43 going down  >>> 
-- URB_FUNCTION_BULK_OR_INTERRUPT_TRANSFER:
  PipeHandle           = 86d6450c [endpoint 0x00000004]
  TransferFlags        = 00000000 (USBD_TRANSFER_DIRECTION_OUT, ~USBD_SHORT_TRANSFER_OK)
  TransferBufferLength = 00000088
  TransferBuffer       = 86d284f0
  TransferBufferMDL    = 00000000
    00000000: 26 25 00 01 00 00 00 00 00 00 00 00 00 00 00 00
    00000010: 00 00 00 00 00 00 00 00 00 00 00 00 00 00 00 00
    00000020: 00 00 00 00 00 00 00 00 00 00 00 00 00 00 00 00
    00000030: 00 00 00 00 00 00 00 00 00 00 00 00 00 00 00 00
    00000040: 00 00 00 00 00 00 00 00 00 00 00 00 00 00 00 00
    00000050: 00 00 00 00 00 00 00 00 00 00 00 00 00 00 00 00
    00000060: 00 00 00 00 00 00 00 00 00 00 00 00 00 00 00 00
    00000070: 00 00 00 00 00 00 00 00 00 00 00 00 00 00 00 00
    00000080: 00 00 00 00 00 26 b4 7e
  UrbLink              = 00000000
[57696 ms] UsbSnoop - MyInternalIOCTLCompletion(a906b126) : fido=868fdb38, Irp=86c8f670, Context=86c46db0, IRQL=2
[57696 ms]  <<<  URB 43 coming back  <<< 
-- URB_FUNCTION_BULK_OR_INTERRUPT_TRANSFER:
  PipeHandle           = 86d6450c [endpoint 0x00000004]
  TransferFlags        = 00000000 (USBD_TRANSFER_DIRECTION_OUT, ~USBD_SHORT_TRANSFER_OK)
  TransferBufferLength = 00000088
  TransferBuffer       = 86d284f0
  TransferBufferMDL    = 86b55150
  UrbLink              = 00000000
[57698 ms] UsbSnoop - MyInternalIOCTLCompletion(a906b126) : fido=00000000, Irp=85efde48, Context=86ca63e8, IRQL=2
[57698 ms]  <<<  URB 42 coming back  <<< 
-- URB_FUNCTION_BULK_OR_INTERRUPT_TRANSFER:
  PipeHandle           = 86d644ec [endpoint 0x00000084]
  TransferFlags        = 00000003 (USBD_TRANSFER_DIRECTION_IN, USBD_SHORT_TRANSFER_OK)
  TransferBufferLength = 00000088
  TransferBuffer       = 85e7d8c0
  TransferBufferMDL    = 86cf8840
    00000000: 26 25 00 01 08 08 00 00 00 00 00 00 00 00 00 00
    00000010: 00 00 00 00 00 00 00 00 00 00 00 00 00 00 00 00
    00000020: 00 00 00 00 00 00 00 00 00 00 00 00 00 00 00 00
    00000030: 00 00 00 00 00 00 00 00 00 00 00 00 00 00 00 00
    00000040: 00 00 00 00 00 00 00 00 00 00 00 00 00 00 00 00
    00000050: 00 00 00 00 00 00 00 00 00 00 00 00 00 00 00 00
    00000060: 00 00 00 00 00 00 00 00 00 00 00 00 00 00 00 00
    00000070: 00 00 00 00 00 00 00 00 00 00 00 00 00 00 00 00
    00000080: 00 00 00 00 00 c1 e1 7e
  UrbLink              = 00000000
[57698 ms] UsbSnoop - FilterDispatchAny(a906afd2) : IRP_MJ_INTERNAL_DEVICE_CONTROL
[57698 ms] UsbSnoop - FdoHookDispatchInternalIoctl(a906b1ea) : fdo=8625f508, Irp=85efde48, IRQL=2
[57698 ms]  >>>  URB 44 going down  >>> 
-- URB_FUNCTION_BULK_OR_INTERRUPT_TRANSFER:
  PipeHandle           = 86d644ec [endpoint 0x00000084]
  TransferFlags        = 00000003 (USBD_TRANSFER_DIRECTION_IN, USBD_SHORT_TRANSFER_OK)
  TransferBufferLength = 00001000
  TransferBuffer       = 85e7d948
  TransferBufferMDL    = 00000000
  UrbLink              = 00000000
[57698 ms] UsbSnoop - FilterDispatchAny(a906afd2) : IRP_MJ_INTERNAL_DEVICE_CONTROL
[57698 ms] UsbSnoop - FdoHookDispatchInternalIoctl(a906b1ea) : fdo=8625f508, Irp=86c8f670, IRQL=0
[57698 ms]  >>>  URB 45 going down  >>> 
-- URB_FUNCTION_BULK_OR_INTERRUPT_TRANSFER:
  PipeHandle           = 86d6450c [endpoint 0x00000004]
  TransferFlags        = 00000000 (USBD_TRANSFER_DIRECTION_OUT, ~USBD_SHORT_TRANSFER_OK)
  TransferBufferLength = 00000089
  TransferBuffer       = 85f19b90
  TransferBufferMDL    = 00000000
    00000000: 26 47 00 00 00 00 00 00 00 00 00 00 00 00 00 00
    00000010: 00 00 00 00 00 00 00 00 00 00 00 00 00 00 00 00
    00000020: 00 00 00 00 00 00 00 00 00 00 00 00 00 00 00 00
    00000030: 00 00 00 00 00 00 00 00 00 00 00 00 00 00 00 00
    00000040: 00 00 00 00 00 00 00 00 00 00 00 00 00 00 00 00
    00000050: 00 00 00 00 00 00 00 00 00 00 00 00 00 00 00 00
    00000060: 00 00 00 00 00 00 00 00 00 00 00 00 00 00 00 00
    00000070: 00 00 00 00 00 00 00 00 00 00 00 00 00 00 00 00
    00000080: 00 00 00 00 00 7d 5f aa 7e
  UrbLink              = 00000000
[57699 ms] UsbSnoop - MyInternalIOCTLCompletion(a906b126) : fido=868fdb38, Irp=86c8f670, Context=86c46db0, IRQL=2
[57699 ms]  <<<  URB 45 coming back  <<< 
-- URB_FUNCTION_BULK_OR_INTERRUPT_TRANSFER:
  PipeHandle           = 86d6450c [endpoint 0x00000004]
  TransferFlags        = 00000000 (USBD_TRANSFER_DIRECTION_OUT, ~USBD_SHORT_TRANSFER_OK)
  TransferBufferLength = 00000089
  TransferBuffer       = 85f19b90
  TransferBufferMDL    = 86b55150
  UrbLink              = 00000000
[57701 ms] UsbSnoop - MyInternalIOCTLCompletion(a906b126) : fido=00000000, Irp=85efde48, Context=86ca63e8, IRQL=2
[57701 ms]  <<<  URB 44 coming back  <<< 
-- URB_FUNCTION_BULK_OR_INTERRUPT_TRANSFER:
  PipeHandle           = 86d644ec [endpoint 0x00000084]
  TransferFlags        = 00000003 (USBD_TRANSFER_DIRECTION_IN, USBD_SHORT_TRANSFER_OK)
  TransferBufferLength = 00000088
  TransferBuffer       = 85e7d948
  TransferBufferMDL    = 86cf8840
    00000000: 26 47 00 42 41 4e 4e 45 52 00 00 00 00 00 00 00
    00000010: 00 00 00 00 00 00 00 00 00 00 00 00 00 00 00 00
    00000020: 00 00 00 00 00 00 00 00 00 00 00 00 00 00 00 00
    00000030: 00 00 00 00 00 00 00 00 00 00 00 00 00 00 00 00
    00000040: 00 00 00 00 00 00 00 00 00 00 00 00 00 00 00 00
    00000050: 00 00 00 00 00 00 00 00 00 00 00 00 00 00 00 00
    00000060: 00 00 00 00 00 00 00 00 00 00 00 00 00 00 00 00
    00000070: 00 00 00 00 00 00 00 00 00 00 00 00 00 00 00 00
    00000080: 00 00 00 00 00 1c ee 7e
  UrbLink              = 00000000
[57701 ms] UsbSnoop - FilterDispatchAny(a906afd2) : IRP_MJ_INTERNAL_DEVICE_CONTROL
[57701 ms] UsbSnoop - FdoHookDispatchInternalIoctl(a906b1ea) : fdo=8625f508, Irp=85efde48, IRQL=2
[57701 ms]  >>>  URB 46 going down  >>> 
-- URB_FUNCTION_BULK_OR_INTERRUPT_TRANSFER:
  PipeHandle           = 86d644ec [endpoint 0x00000084]
  TransferFlags        = 00000003 (USBD_TRANSFER_DIRECTION_IN, USBD_SHORT_TRANSFER_OK)
  TransferBufferLength = 00001000
  TransferBuffer       = 85e7d9d0
  TransferBufferMDL    = 00000000
  UrbLink              = 00000000
[57701 ms] UsbSnoop - FilterDispatchAny(a906afd2) : IRP_MJ_INTERNAL_DEVICE_CONTROL
[57701 ms] UsbSnoop - FdoHookDispatchInternalIoctl(a906b1ea) : fdo=8625f508, Irp=86baa278, IRQL=0
[57701 ms]  >>>  URB 47 going down  >>> 
-- URB_FUNCTION_BULK_OR_INTERRUPT_TRANSFER:
  PipeHandle           = 86d6450c [endpoint 0x00000004]
  TransferFlags        = 00000000 (USBD_TRANSFER_DIRECTION_OUT, ~USBD_SHORT_TRANSFER_OK)
  TransferBufferLength = 00000088
  TransferBuffer       = 86d284f0
  TransferBufferMDL    = 00000000
    00000000: 26 2b 00 01 00 00 00 00 00 00 00 00 00 00 00 00
    00000010: 00 00 00 00 00 00 00 00 00 00 00 00 00 00 00 00
    00000020: 00 00 00 00 00 00 00 00 00 00 00 00 00 00 00 00
    00000030: 00 00 00 00 00 00 00 00 00 00 00 00 00 00 00 00
    00000040: 00 00 00 00 00 00 00 00 00 00 00 00 00 00 00 00
    00000050: 00 00 00 00 00 00 00 00 00 00 00 00 00 00 00 00
    00000060: 00 00 00 00 00 00 00 00 00 00 00 00 00 00 00 00
    00000070: 00 00 00 00 00 00 00 00 00 00 00 00 00 00 00 00
    00000080: 00 00 00 00 00 9f 39 7e
  UrbLink              = 00000000
[57702 ms] UsbSnoop - MyInternalIOCTLCompletion(a906b126) : fido=868fdb38, Irp=86baa278, Context=86c46db0, IRQL=2
[57702 ms]  <<<  URB 47 coming back  <<< 
-- URB_FUNCTION_BULK_OR_INTERRUPT_TRANSFER:
  PipeHandle           = 86d6450c [endpoint 0x00000004]
  TransferFlags        = 00000000 (USBD_TRANSFER_DIRECTION_OUT, ~USBD_SHORT_TRANSFER_OK)
  TransferBufferLength = 00000088
  TransferBuffer       = 86d284f0
  TransferBufferMDL    = 86b55150
  UrbLink              = 00000000
[57704 ms] UsbSnoop - MyInternalIOCTLCompletion(a906b126) : fido=00000000, Irp=85efde48, Context=86ca63e8, IRQL=2
[57704 ms]  <<<  URB 46 coming back  <<< 
-- URB_FUNCTION_BULK_OR_INTERRUPT_TRANSFER:
  PipeHandle           = 86d644ec [endpoint 0x00000084]
  TransferFlags        = 00000003 (USBD_TRANSFER_DIRECTION_IN, USBD_SHORT_TRANSFER_OK)
  TransferBufferLength = 00000088
  TransferBuffer       = 85e7d9d0
  TransferBufferMDL    = 86cf8840
    00000000: 26 2b 00 01 20 20 20 20 20 20 20 45 6d 70 74 79
    00000010: 00 00 00 00 00 00 00 00 00 00 00 00 00 00 00 00
    00000020: 00 00 00 00 00 00 00 00 00 00 00 00 00 00 00 00
    00000030: 00 00 00 00 00 00 00 00 00 00 00 00 00 00 00 00
    00000040: 00 00 00 00 00 00 00 00 00 00 00 00 00 00 00 00
    00000050: 00 00 00 00 00 00 00 00 00 00 00 00 00 00 00 00
    00000060: 00 00 00 00 00 00 00 00 00 00 00 00 00 00 00 00
    00000070: 00 00 00 00 00 00 00 00 00 00 00 00 00 00 00 00
    00000080: 00 00 00 00 00 54 88 7e
  UrbLink              = 00000000
[57704 ms] UsbSnoop - FilterDispatchAny(a906afd2) : IRP_MJ_INTERNAL_DEVICE_CONTROL
[57704 ms] UsbSnoop - FdoHookDispatchInternalIoctl(a906b1ea) : fdo=8625f508, Irp=85efde48, IRQL=2
[57704 ms]  >>>  URB 48 going down  >>> 
-- URB_FUNCTION_BULK_OR_INTERRUPT_TRANSFER:
  PipeHandle           = 86d644ec [endpoint 0x00000084]
  TransferFlags        = 00000003 (USBD_TRANSFER_DIRECTION_IN, USBD_SHORT_TRANSFER_OK)
  TransferBufferLength = 00001000
  TransferBuffer       = 85e7da58
  TransferBufferMDL    = 00000000
  UrbLink              = 00000000
[57708 ms] UsbSnoop - FilterDispatchAny(a906afd2) : IRP_MJ_INTERNAL_DEVICE_CONTROL
[57708 ms] UsbSnoop - FdoHookDispatchInternalIoctl(a906b1ea) : fdo=8625f508, Irp=86baa278, IRQL=0
[57708 ms]  >>>  URB 49 going down  >>> 
-- URB_FUNCTION_BULK_OR_INTERRUPT_TRANSFER:
  PipeHandle           = 86d6450c [endpoint 0x00000004]
  TransferFlags        = 00000000 (USBD_TRANSFER_DIRECTION_OUT, ~USBD_SHORT_TRANSFER_OK)
  TransferBufferLength = 00000088
  TransferBuffer       = 86d284f0
  TransferBufferMDL    = 00000000
    00000000: 26 0a 01 01 00 00 00 00 00 00 00 00 00 00 00 00
    00000010: 00 00 00 00 00 00 00 00 00 00 00 00 00 00 00 00
    00000020: 00 00 00 00 00 00 00 00 00 00 00 00 00 00 00 00
    00000030: 00 00 00 00 00 00 00 00 00 00 00 00 00 00 00 00
    00000040: 00 00 00 00 00 00 00 00 00 00 00 00 00 00 00 00
    00000050: 00 00 00 00 00 00 00 00 00 00 00 00 00 00 00 00
    00000060: 00 00 00 00 00 00 00 00 00 00 00 00 00 00 00 00
    00000070: 00 00 00 00 00 00 00 00 00 00 00 00 00 00 00 00
    00000080: 00 00 00 00 00 87 02 7e
  UrbLink              = 00000000
[57709 ms] UsbSnoop - MyInternalIOCTLCompletion(a906b126) : fido=868fdb38, Irp=86baa278, Context=86c46db0, IRQL=2
[57709 ms]  <<<  URB 49 coming back  <<< 
-- URB_FUNCTION_BULK_OR_INTERRUPT_TRANSFER:
  PipeHandle           = 86d6450c [endpoint 0x00000004]
  TransferFlags        = 00000000 (USBD_TRANSFER_DIRECTION_OUT, ~USBD_SHORT_TRANSFER_OK)
  TransferBufferLength = 00000088
  TransferBuffer       = 86d284f0
  TransferBufferMDL    = 86b55150
  UrbLink              = 00000000
[57711 ms] UsbSnoop - MyInternalIOCTLCompletion(a906b126) : fido=00000000, Irp=85efde48, Context=86ca63e8, IRQL=2
[57711 ms]  <<<  URB 48 coming back  <<< 
-- URB_FUNCTION_BULK_OR_INTERRUPT_TRANSFER:
  PipeHandle           = 86d644ec [endpoint 0x00000084]
  TransferFlags        = 00000003 (USBD_TRANSFER_DIRECTION_IN, USBD_SHORT_TRANSFER_OK)
  TransferBufferLength = 00000088
  TransferBuffer       = 85e7da58
  TransferBufferMDL    = 86cf8840
    00000000: 26 0a 01 01 ff 00 00 00 00 00 00 00 00 00 00 00
    00000010: 00 00 00 00 00 00 00 00 00 00 00 00 00 00 00 00
    00000020: 00 00 00 00 00 00 00 00 00 00 00 00 00 00 00 00
    00000030: 00 00 00 00 00 00 00 00 00 00 00 00 00 00 00 00
    00000040: 00 00 00 00 00 00 00 00 00 00 00 00 00 00 00 00
    00000050: 00 00 00 00 00 00 00 00 00 00 00 00 00 00 00 00
    00000060: 00 00 00 00 00 00 00 00 00 00 00 00 00 00 00 00
    00000070: 00 00 00 00 00 00 00 00 00 00 00 00 00 00 00 00
    00000080: 00 00 00 00 00 e9 59 7e
  UrbLink              = 00000000
[57711 ms] UsbSnoop - FilterDispatchAny(a906afd2) : IRP_MJ_INTERNAL_DEVICE_CONTROL
[57711 ms] UsbSnoop - FdoHookDispatchInternalIoctl(a906b1ea) : fdo=8625f508, Irp=85efde48, IRQL=2
[57711 ms]  >>>  URB 50 going down  >>> 
-- URB_FUNCTION_BULK_OR_INTERRUPT_TRANSFER:
  PipeHandle           = 86d644ec [endpoint 0x00000084]
  TransferFlags        = 00000003 (USBD_TRANSFER_DIRECTION_IN, USBD_SHORT_TRANSFER_OK)
  TransferBufferLength = 00001000
  TransferBuffer       = 85e7dae0
  TransferBufferMDL    = 00000000
  UrbLink              = 00000000
[57712 ms] UsbSnoop - FilterDispatchAny(a906afd2) : IRP_MJ_INTERNAL_DEVICE_CONTROL
[57712 ms] UsbSnoop - FdoHookDispatchInternalIoctl(a906b1ea) : fdo=8625f508, Irp=86baa278, IRQL=0
[57712 ms]  >>>  URB 51 going down  >>> 
-- URB_FUNCTION_BULK_OR_INTERRUPT_TRANSFER:
  PipeHandle           = 86d6450c [endpoint 0x00000004]
  TransferFlags        = 00000000 (USBD_TRANSFER_DIRECTION_OUT, ~USBD_SHORT_TRANSFER_OK)
  TransferBufferLength = 00000088
  TransferBuffer       = 86d284f0
  TransferBufferMDL    = 00000000
    00000000: 26 08 01 01 00 00 00 00 00 00 00 00 00 00 00 00
    00000010: 00 00 00 00 00 00 00 00 00 00 00 00 00 00 00 00
    00000020: 00 00 00 00 00 00 00 00 00 00 00 00 00 00 00 00
    00000030: 00 00 00 00 00 00 00 00 00 00 00 00 00 00 00 00
    00000040: 00 00 00 00 00 00 00 00 00 00 00 00 00 00 00 00
    00000050: 00 00 00 00 00 00 00 00 00 00 00 00 00 00 00 00
    00000060: 00 00 00 00 00 00 00 00 00 00 00 00 00 00 00 00
    00000070: 00 00 00 00 00 00 00 00 00 00 00 00 00 00 00 00
    00000080: 00 00 00 00 00 d4 36 7e
  UrbLink              = 00000000
[57713 ms] UsbSnoop - MyInternalIOCTLCompletion(a906b126) : fido=868fdb38, Irp=86baa278, Context=86c46db0, IRQL=2
[57713 ms]  <<<  URB 51 coming back  <<< 
-- URB_FUNCTION_BULK_OR_INTERRUPT_TRANSFER:
  PipeHandle           = 86d6450c [endpoint 0x00000004]
  TransferFlags        = 00000000 (USBD_TRANSFER_DIRECTION_OUT, ~USBD_SHORT_TRANSFER_OK)
  TransferBufferLength = 00000088
  TransferBuffer       = 86d284f0
  TransferBufferMDL    = 86b55150
  UrbLink              = 00000000
[57715 ms] UsbSnoop - MyInternalIOCTLCompletion(a906b126) : fido=00000000, Irp=85efde48, Context=86ca63e8, IRQL=2
[57715 ms]  <<<  URB 50 coming back  <<< 
-- URB_FUNCTION_BULK_OR_INTERRUPT_TRANSFER:
  PipeHandle           = 86d644ec [endpoint 0x00000084]
  TransferFlags        = 00000003 (USBD_TRANSFER_DIRECTION_IN, USBD_SHORT_TRANSFER_OK)
  TransferBufferLength = 00000088
  TransferBuffer       = 85e7dae0
  TransferBufferMDL    = 86cf8840
    00000000: 26 08 01 01 c8 00 00 00 00 00 00 00 00 00 00 00
    00000010: 00 00 00 00 00 00 00 00 00 00 00 00 00 00 00 00
    00000020: 00 00 00 00 00 00 00 00 00 00 00 00 00 00 00 00
    00000030: 00 00 00 00 00 00 00 00 00 00 00 00 00 00 00 00
    00000040: 00 00 00 00 00 00 00 00 00 00 00 00 00 00 00 00
    00000050: 00 00 00 00 00 00 00 00 00 00 00 00 00 00 00 00
    00000060: 00 00 00 00 00 00 00 00 00 00 00 00 00 00 00 00
    00000070: 00 00 00 00 00 00 00 00 00 00 00 00 00 00 00 00
    00000080: 00 00 00 00 00 f4 4d 7e
  UrbLink              = 00000000
[57715 ms] UsbSnoop - FilterDispatchAny(a906afd2) : IRP_MJ_INTERNAL_DEVICE_CONTROL
[57715 ms] UsbSnoop - FdoHookDispatchInternalIoctl(a906b1ea) : fdo=8625f508, Irp=85efde48, IRQL=2
[57715 ms]  >>>  URB 52 going down  >>> 
-- URB_FUNCTION_BULK_OR_INTERRUPT_TRANSFER:
  PipeHandle           = 86d644ec [endpoint 0x00000084]
  TransferFlags        = 00000003 (USBD_TRANSFER_DIRECTION_IN, USBD_SHORT_TRANSFER_OK)
  TransferBufferLength = 00001000
  TransferBuffer       = 85e7db68
  TransferBufferMDL    = 00000000
  UrbLink              = 00000000
[57717 ms] UsbSnoop - FilterDispatchAny(a906afd2) : IRP_MJ_INTERNAL_DEVICE_CONTROL
[57717 ms] UsbSnoop - FdoHookDispatchInternalIoctl(a906b1ea) : fdo=8625f508, Irp=86baa278, IRQL=0
[57717 ms]  >>>  URB 53 going down  >>> 
-- URB_FUNCTION_BULK_OR_INTERRUPT_TRANSFER:
  PipeHandle           = 86d6450c [endpoint 0x00000004]
  TransferFlags        = 00000000 (USBD_TRANSFER_DIRECTION_OUT, ~USBD_SHORT_TRANSFER_OK)
  TransferBufferLength = 00000088
  TransferBuffer       = 86d284f0
  TransferBufferMDL    = 00000000
    00000000: 26 09 01 01 00 00 00 00 00 00 00 00 00 00 00 00
    00000010: 00 00 00 00 00 00 00 00 00 00 00 00 00 00 00 00
    00000020: 00 00 00 00 00 00 00 00 00 00 00 00 00 00 00 00
    00000030: 00 00 00 00 00 00 00 00 00 00 00 00 00 00 00 00
    00000040: 00 00 00 00 00 00 00 00 00 00 00 00 00 00 00 00
    00000050: 00 00 00 00 00 00 00 00 00 00 00 00 00 00 00 00
    00000060: 00 00 00 00 00 00 00 00 00 00 00 00 00 00 00 00
    00000070: 00 00 00 00 00 00 00 00 00 00 00 00 00 00 00 00
    00000080: 00 00 00 00 00 f5 a8 7e
  UrbLink              = 00000000
[57718 ms] UsbSnoop - MyInternalIOCTLCompletion(a906b126) : fido=868fdb38, Irp=86baa278, Context=86c46db0, IRQL=2
[57718 ms]  <<<  URB 53 coming back  <<< 
-- URB_FUNCTION_BULK_OR_INTERRUPT_TRANSFER:
  PipeHandle           = 86d6450c [endpoint 0x00000004]
  TransferFlags        = 00000000 (USBD_TRANSFER_DIRECTION_OUT, ~USBD_SHORT_TRANSFER_OK)
  TransferBufferLength = 00000088
  TransferBuffer       = 86d284f0
  TransferBufferMDL    = 86b55150
  UrbLink              = 00000000
[57720 ms] UsbSnoop - MyInternalIOCTLCompletion(a906b126) : fido=00000000, Irp=85efde48, Context=86ca63e8, IRQL=2
[57720 ms]  <<<  URB 52 coming back  <<< 
-- URB_FUNCTION_BULK_OR_INTERRUPT_TRANSFER:
  PipeHandle           = 86d644ec [endpoint 0x00000084]
  TransferFlags        = 00000003 (USBD_TRANSFER_DIRECTION_IN, USBD_SHORT_TRANSFER_OK)
  TransferBufferLength = 00000088
  TransferBuffer       = 85e7db68
  TransferBufferMDL    = 86cf8840
    00000000: 26 09 01 01 10 00 00 00 00 00 00 00 00 00 00 00
    00000010: 00 00 00 00 00 00 00 00 00 00 00 00 00 00 00 00
    00000020: 00 00 00 00 00 00 00 00 00 00 00 00 00 00 00 00
    00000030: 00 00 00 00 00 00 00 00 00 00 00 00 00 00 00 00
    00000040: 00 00 00 00 00 00 00 00 00 00 00 00 00 00 00 00
    00000050: 00 00 00 00 00 00 00 00 00 00 00 00 00 00 00 00
    00000060: 00 00 00 00 00 00 00 00 00 00 00 00 00 00 00 00
    00000070: 00 00 00 00 00 00 00 00 00 00 00 00 00 00 00 00
    00000080: 00 00 00 00 00 10 37 7e
  UrbLink              = 00000000
[57720 ms] UsbSnoop - FilterDispatchAny(a906afd2) : IRP_MJ_INTERNAL_DEVICE_CONTROL
[57720 ms] UsbSnoop - FdoHookDispatchInternalIoctl(a906b1ea) : fdo=8625f508, Irp=85efde48, IRQL=2
[57720 ms]  >>>  URB 54 going down  >>> 
-- URB_FUNCTION_BULK_OR_INTERRUPT_TRANSFER:
  PipeHandle           = 86d644ec [endpoint 0x00000084]
  TransferFlags        = 00000003 (USBD_TRANSFER_DIRECTION_IN, USBD_SHORT_TRANSFER_OK)
  TransferBufferLength = 00001000
  TransferBuffer       = 85e7dbf0
  TransferBufferMDL    = 00000000
  UrbLink              = 00000000
[57721 ms] UsbSnoop - FilterDispatchAny(a906afd2) : IRP_MJ_INTERNAL_DEVICE_CONTROL
[57721 ms] UsbSnoop - FdoHookDispatchInternalIoctl(a906b1ea) : fdo=8625f508, Irp=86baa278, IRQL=0
[57721 ms]  >>>  URB 55 going down  >>> 
-- URB_FUNCTION_BULK_OR_INTERRUPT_TRANSFER:
  PipeHandle           = 86d6450c [endpoint 0x00000004]
  TransferFlags        = 00000000 (USBD_TRANSFER_DIRECTION_OUT, ~USBD_SHORT_TRANSFER_OK)
  TransferBufferLength = 00000088
  TransferBuffer       = 86d284f0
  TransferBufferMDL    = 00000000
    00000000: 26 07 01 01 00 00 00 00 00 00 00 00 00 00 00 00
    00000010: 00 00 00 00 00 00 00 00 00 00 00 00 00 00 00 00
    00000020: 00 00 00 00 00 00 00 00 00 00 00 00 00 00 00 00
    00000030: 00 00 00 00 00 00 00 00 00 00 00 00 00 00 00 00
    00000040: 00 00 00 00 00 00 00 00 00 00 00 00 00 00 00 00
    00000050: 00 00 00 00 00 00 00 00 00 00 00 00 00 00 00 00
    00000060: 00 00 00 00 00 00 00 00 00 00 00 00 00 00 00 00
    00000070: 00 00 00 00 00 00 00 00 00 00 00 00 00 00 00 00
    00000080: 00 00 00 00 00 4c 25 7e
  UrbLink              = 00000000
[57722 ms] UsbSnoop - MyInternalIOCTLCompletion(a906b126) : fido=868fdb38, Irp=86baa278, Context=86c46db0, IRQL=2
[57722 ms]  <<<  URB 55 coming back  <<< 
-- URB_FUNCTION_BULK_OR_INTERRUPT_TRANSFER:
  PipeHandle           = 86d6450c [endpoint 0x00000004]
  TransferFlags        = 00000000 (USBD_TRANSFER_DIRECTION_OUT, ~USBD_SHORT_TRANSFER_OK)
  TransferBufferLength = 00000088
  TransferBuffer       = 86d284f0
  TransferBufferMDL    = 86b55150
  UrbLink              = 00000000
[57724 ms] UsbSnoop - MyInternalIOCTLCompletion(a906b126) : fido=00000000, Irp=85efde48, Context=86ca63e8, IRQL=2
[57724 ms]  <<<  URB 54 coming back  <<< 
-- URB_FUNCTION_BULK_OR_INTERRUPT_TRANSFER:
  PipeHandle           = 86d644ec [endpoint 0x00000084]
  TransferFlags        = 00000003 (USBD_TRANSFER_DIRECTION_IN, USBD_SHORT_TRANSFER_OK)
  TransferBufferLength = 00000088
  TransferBuffer       = 85e7dbf0
  TransferBufferMDL    = 85fc90f0
    00000000: 26 07 01 01 e7 03 e7 03 00 00 00 00 00 00 00 00
    00000010: 00 00 00 00 00 00 00 00 00 00 00 00 00 00 00 00
    00000020: 00 00 00 00 00 00 00 00 00 00 00 00 00 00 00 00
    00000030: 00 00 00 00 00 00 00 00 00 00 00 00 00 00 00 00
    00000040: 00 00 00 00 00 00 00 00 00 00 00 00 00 00 00 00
    00000050: 00 00 00 00 00 00 00 00 00 00 00 00 00 00 00 00
    00000060: 00 00 00 00 00 00 00 00 00 00 00 00 00 00 00 00
    00000070: 00 00 00 00 00 00 00 00 00 00 00 00 00 00 00 00
    00000080: 00 00 00 00 00 86 85 7e
  UrbLink              = 00000000
[57724 ms] UsbSnoop - FilterDispatchAny(a906afd2) : IRP_MJ_INTERNAL_DEVICE_CONTROL
[57724 ms] UsbSnoop - FdoHookDispatchInternalIoctl(a906b1ea) : fdo=8625f508, Irp=85efde48, IRQL=2
[57724 ms]  >>>  URB 56 going down  >>> 
-- URB_FUNCTION_BULK_OR_INTERRUPT_TRANSFER:
  PipeHandle           = 86d644ec [endpoint 0x00000084]
  TransferFlags        = 00000003 (USBD_TRANSFER_DIRECTION_IN, USBD_SHORT_TRANSFER_OK)
  TransferBufferLength = 00001000
  TransferBuffer       = 85e7dc78
  TransferBufferMDL    = 00000000
  UrbLink              = 00000000
[57725 ms] UsbSnoop - FilterDispatchAny(a906afd2) : IRP_MJ_INTERNAL_DEVICE_CONTROL
[57725 ms] UsbSnoop - FdoHookDispatchInternalIoctl(a906b1ea) : fdo=8625f508, Irp=86baa278, IRQL=0
[57725 ms]  >>>  URB 57 going down  >>> 
-- URB_FUNCTION_BULK_OR_INTERRUPT_TRANSFER:
  PipeHandle           = 86d6450c [endpoint 0x00000004]
  TransferFlags        = 00000000 (USBD_TRANSFER_DIRECTION_OUT, ~USBD_SHORT_TRANSFER_OK)
  TransferBufferLength = 00000088
  TransferBuffer       = 86d284f0
  TransferBufferMDL    = 00000000
    00000000: 26 06 01 01 00 00 00 00 00 00 00 00 00 00 00 00
    00000010: 00 00 00 00 00 00 00 00 00 00 00 00 00 00 00 00
    00000020: 00 00 00 00 00 00 00 00 00 00 00 00 00 00 00 00
    00000030: 00 00 00 00 00 00 00 00 00 00 00 00 00 00 00 00
    00000040: 00 00 00 00 00 00 00 00 00 00 00 00 00 00 00 00
    00000050: 00 00 00 00 00 00 00 00 00 00 00 00 00 00 00 00
    00000060: 00 00 00 00 00 00 00 00 00 00 00 00 00 00 00 00
    00000070: 00 00 00 00 00 00 00 00 00 00 00 00 00 00 00 00
    00000080: 00 00 00 00 00 6d bb 7e
  UrbLink              = 00000000
[57726 ms] UsbSnoop - MyInternalIOCTLCompletion(a906b126) : fido=868fdb38, Irp=86baa278, Context=86c46db0, IRQL=2
[57726 ms]  <<<  URB 57 coming back  <<< 
-- URB_FUNCTION_BULK_OR_INTERRUPT_TRANSFER:
  PipeHandle           = 86d6450c [endpoint 0x00000004]
  TransferFlags        = 00000000 (USBD_TRANSFER_DIRECTION_OUT, ~USBD_SHORT_TRANSFER_OK)
  TransferBufferLength = 00000088
  TransferBuffer       = 86d284f0
  TransferBufferMDL    = 86b55150
  UrbLink              = 00000000
[57728 ms] UsbSnoop - MyInternalIOCTLCompletion(a906b126) : fido=00000000, Irp=85efde48, Context=86ca63e8, IRQL=2
[57728 ms]  <<<  URB 56 coming back  <<< 
-- URB_FUNCTION_BULK_OR_INTERRUPT_TRANSFER:
  PipeHandle           = 86d644ec [endpoint 0x00000084]
  TransferFlags        = 00000003 (USBD_TRANSFER_DIRECTION_IN, USBD_SHORT_TRANSFER_OK)
  TransferBufferLength = 00000088
  TransferBuffer       = 85e7dc78
  TransferBufferMDL    = 85fc90f0
    00000000: 26 06 01 01 e7 eb f9 00 59 eb f9 00 00 00 00 00
    00000010: 00 00 00 00 00 00 00 00 00 00 00 00 00 00 00 00
    00000020: 00 00 00 00 00 00 00 00 00 00 00 00 00 00 00 00
    00000030: 00 00 00 00 00 00 00 00 00 00 00 00 00 00 00 00
    00000040: 00 00 00 00 00 00 00 00 00 00 00 00 00 00 00 00
    00000050: 00 00 00 00 00 00 00 00 00 00 00 00 00 00 00 00
    00000060: 00 00 00 00 00 00 00 00 00 00 00 00 00 00 00 00
    00000070: 00 00 00 00 00 00 00 00 00 00 00 00 00 00 00 00
    00000080: 00 00 00 00 00 b7 d3 7e
  UrbLink              = 00000000
[57728 ms] UsbSnoop - FilterDispatchAny(a906afd2) : IRP_MJ_INTERNAL_DEVICE_CONTROL
[57728 ms] UsbSnoop - FdoHookDispatchInternalIoctl(a906b1ea) : fdo=8625f508, Irp=85efde48, IRQL=2
[57728 ms]  >>>  URB 58 going down  >>> 
-- URB_FUNCTION_BULK_OR_INTERRUPT_TRANSFER:
  PipeHandle           = 86d644ec [endpoint 0x00000084]
  TransferFlags        = 00000003 (USBD_TRANSFER_DIRECTION_IN, USBD_SHORT_TRANSFER_OK)
  TransferBufferLength = 00001000
  TransferBuffer       = 85e7dd00
  TransferBufferMDL    = 00000000
  UrbLink              = 00000000
[57730 ms] UsbSnoop - FilterDispatchAny(a906afd2) : IRP_MJ_INTERNAL_DEVICE_CONTROL
[57730 ms] UsbSnoop - FdoHookDispatchInternalIoctl(a906b1ea) : fdo=8625f508, Irp=86baa278, IRQL=0
[57730 ms]  >>>  URB 59 going down  >>> 
-- URB_FUNCTION_BULK_OR_INTERRUPT_TRANSFER:
  PipeHandle           = 86d6450c [endpoint 0x00000004]
  TransferFlags        = 00000000 (USBD_TRANSFER_DIRECTION_OUT, ~USBD_SHORT_TRANSFER_OK)
  TransferBufferLength = 00000088
  TransferBuffer       = 86d284f0
  TransferBufferMDL    = 00000000
    00000000: 26 05 01 01 00 00 00 00 00 00 00 00 00 00 00 00
    00000010: 00 00 00 00 00 00 00 00 00 00 00 00 00 00 00 00
    00000020: 00 00 00 00 00 00 00 00 00 00 00 00 00 00 00 00
    00000030: 00 00 00 00 00 00 00 00 00 00 00 00 00 00 00 00
    00000040: 00 00 00 00 00 00 00 00 00 00 00 00 00 00 00 00
    00000050: 00 00 00 00 00 00 00 00 00 00 00 00 00 00 00 00
    00000060: 00 00 00 00 00 00 00 00 00 00 00 00 00 00 00 00
    00000070: 00 00 00 00 00 00 00 00 00 00 00 00 00 00 00 00
    00000080: 00 00 00 00 00 1f 11 7e
  UrbLink              = 00000000
[57731 ms] UsbSnoop - MyInternalIOCTLCompletion(a906b126) : fido=868fdb38, Irp=86baa278, Context=86c46db0, IRQL=2
[57731 ms]  <<<  URB 59 coming back  <<< 
-- URB_FUNCTION_BULK_OR_INTERRUPT_TRANSFER:
  PipeHandle           = 86d6450c [endpoint 0x00000004]
  TransferFlags        = 00000000 (USBD_TRANSFER_DIRECTION_OUT, ~USBD_SHORT_TRANSFER_OK)
  TransferBufferLength = 00000088
  TransferBuffer       = 86d284f0
  TransferBufferMDL    = 86b55150
  UrbLink              = 00000000
[57733 ms] UsbSnoop - MyInternalIOCTLCompletion(a906b126) : fido=00000000, Irp=85efde48, Context=86ca63e8, IRQL=2
[57733 ms]  <<<  URB 58 coming back  <<< 
-- URB_FUNCTION_BULK_OR_INTERRUPT_TRANSFER:
  PipeHandle           = 86d644ec [endpoint 0x00000084]
  TransferFlags        = 00000003 (USBD_TRANSFER_DIRECTION_IN, USBD_SHORT_TRANSFER_OK)
  TransferBufferLength = 00000088
  TransferBuffer       = 85e7dd00
  TransferBufferMDL    = 85fc90f0
    00000000: 26 05 01 01 00 00 00 00 00 00 00 00 00 00 00 00
    00000010: 00 00 00 00 00 00 00 00 00 00 00 00 00 00 00 00
    00000020: 00 00 00 00 00 00 00 00 00 00 00 00 00 00 00 00
    00000030: 00 00 00 00 00 00 00 00 00 00 00 00 00 00 00 00
    00000040: 00 00 00 00 00 00 00 00 00 00 00 00 00 00 00 00
    00000050: 00 00 00 00 00 00 00 00 00 00 00 00 00 00 00 00
    00000060: 00 00 00 00 00 00 00 00 00 00 00 00 00 00 00 00
    00000070: 00 00 00 00 00 00 00 00 00 00 00 00 00 00 00 00
    00000080: 00 00 00 00 00 1f 11 7e
  UrbLink              = 00000000
[57733 ms] UsbSnoop - FilterDispatchAny(a906afd2) : IRP_MJ_INTERNAL_DEVICE_CONTROL
[57733 ms] UsbSnoop - FdoHookDispatchInternalIoctl(a906b1ea) : fdo=8625f508, Irp=85efde48, IRQL=2
[57733 ms]  >>>  URB 60 going down  >>> 
-- URB_FUNCTION_BULK_OR_INTERRUPT_TRANSFER:
  PipeHandle           = 86d644ec [endpoint 0x00000084]
  TransferFlags        = 00000003 (USBD_TRANSFER_DIRECTION_IN, USBD_SHORT_TRANSFER_OK)
  TransferBufferLength = 00001000
  TransferBuffer       = 85e7dd88
  TransferBufferMDL    = 00000000
  UrbLink              = 00000000
